version  7_5_29    13-06-2017    VERS_7_5_29   commit_2017-06-20

version  7_5_29    13-06-2017    VERS_7_5_29   commit_2017-06-15

version  7_5_29    13-06-2017    VERS_7_5_29

========================================================== 13-06-2017 - 7_5_29

c ./fem3d/subver.f:
c 13.06.2017	ggu	version 7.5.29	San Antonio's name day release '
c
c ./fem3d/subsys.f:
c 26.05.2017	ggu	default of ishyff is 1 - no nos or ous files

==========================================================

version  7_5_28    25-05-2017    VERS_7_5_28   commit_2017-06-13

version  7_5_28    25-05-2017    VERS_7_5_28   commit_2017-06-12

version  7_5_28    25-05-2017    VERS_7_5_28   commit_2017-06-09

version  7_5_28    25-05-2017    VERS_7_5_28   commit_2017-06-04

version  7_5_28    25-05-2017    VERS_7_5_28   commit_2017-05-26

version  7_5_28    25-05-2017    VERS_7_5_28

========================================================== 25-05-2017 - 7_5_28

c ./fem3d/femelab.f:
! 16.05.2017    ggu&mbj better handling of points to extract
c
c ./fem3d/subver.f:
c 25.05.2017	ggu	version 7.5.28
c
c ./fem3d/subreg.f:
c 23.05.2017	ggu	file split into subreg, submask and subfind

==========================================================

version  7_5_27a    16-05-2017    VERS_7_5_27a   commit_2017-05-25

version  7_5_27a    16-05-2017    VERS_7_5_27a   commit_2017-05-19

version  7_5_27a    16-05-2017    VERS_7_5_27a   commit_2017-05-16

version  7_5_27a    16-05-2017    VERS_7_5_27a

========================================================== 16-05-2017 - 7_5_27a

No revision log.

==========================================================

version  7_5_27    16-05-2017    VERS_7_5_27

========================================================== 16-05-2017 - 7_5_27

No revision log.

==========================================================

version  7_5_27    16-05-2017    VERS_7_5_27   commit_2017-05-16

version  7_5_27    16-05-2017    VERS_7_5_27   commit_2017-05-16

version  7_5_27    16-05-2017    VERS_7_5_27

========================================================== 16-05-2017 - 7_5_27

c ./fem3d/subtsfile.f:
c 15.05.2017    ggu     new version to also read time string
c
c ./fem3d/subiso8601.f:
! 10.05.2017    ggu     started
! 15.05.2017    ggu     finished
!
c ./fem3d/subscn.f:
c 15.05.2017	ggu	bug fix in istod -> do not change ioff on error
c
c ./fem3d/shyelab1.f:
! 11.05.2017    ggu     use catmode to concatenate files
c
c ./fem3d/subver.f:
c 16.05.2017	ggu	version 7.5.27	Beppe's 50th birthday release '

==========================================================

version  7_5_26    09-05-2017    VERS_7_5_26   commit_2017-05-16

version  7_5_26    09-05-2017    VERS_7_5_26   commit_2017-05-11

version  7_5_26    09-05-2017    VERS_7_5_26

========================================================== 09-05-2017 - 7_5_26

c ./fem3d/netcdf.f:
c 21.04.2017    ggu	some more utility routines
c
c ./fem3d/subfemintp.f:
! 23.04.2017	ggu	prepared for regular grid BC interpolation
!
c ./fem3d/subscn.f:
c 15.04.2017	ggu	new routines istot
c
c ./fem3d/subdef.f:
c 09.05.2017    ggu     add_extension renamed to subst_extension, new add_extension
c
c ./fem3d/subver.f:
c 09.05.2017	ggu	version 7.5.26
c
c ./fem3d/subssed.f:
! 09.05.2017	ggu	some bugs fixed
!
c ./fem3d/subreg.f:
c 23.04.2017	ggu	new routine intp_reg_single_nodes()
c
c ./fem3d/subn35.f:
c 09.05.2017    ggu     bug fix for computing bottom stress

==========================================================

version  7_5_25    13-04-2017    VERS_7_5_25   commit_2017-05-09

version  7_5_25    13-04-2017    VERS_7_5_25   commit_2017-05-09

version  7_5_25    13-04-2017    VERS_7_5_25   commit_2017-05-08

version  7_5_25    13-04-2017    VERS_7_5_25   commit_2017-05-08

version  7_5_25    13-04-2017    VERS_7_5_25   commit_2017-04-26

version  7_5_25    13-04-2017    VERS_7_5_25   commit_2017-04-26

version  7_5_25    13-04-2017    VERS_7_5_25   commit_2017-04-26

version  7_5_25    13-04-2017    VERS_7_5_25   commit_2017-04-21

version  7_5_25    13-04-2017    VERS_7_5_25

========================================================== 13-04-2017 - 7_5_25

c ./fem3d/subwaves.f:
! 12.04.2017	ggu	routines integrated to compute bottom stress, new module
!
c ./fem3d/subpar3.f:
c 13.04.2017    ggu     new array feature
c
c ./fem3d/newconz.f:
c 13.04.2017    ggu     contau deprecated... use taupar (array)
c
c ./fem3d/subver.f:
c 13.04.2017	ggu	version 7.5.25	pre Good Friday release
c
c ./fem3d/subn35.f:
c 10.04.2017    ggu     compute cd, normalized bottom stress and bottom stress
c
c ./fem3d/subbnd.f:
c 13.04.2017    ggu	use array feature of para for kbound

==========================================================

version  7_5_24    31-03-2017    VERS_7_5_24   commit_2017-04-13

version  7_5_24    31-03-2017    VERS_7_5_24   commit_2017-03-31

version  7_5_24    31-03-2017    VERS_7_5_24

========================================================== 31-03-2017 - 7_5_24

c ./femplot/supsim.f:
c 21.03.2017    ggu	new parameter valmax introduced
c
c ./femplot/shyplot.f:
! 14.02.2017    ggu     bug fix in plotting regular fem files - introduced il
c
c ./fem3d/elabutil.f:
! 21.03.2017	ggu	mode renamed to avermode
! 23.03.2017	ccf	line routines introduced
!
c ./fem3d/subflxu.f:
c 30.03.2017    ggu     changed accumulator to time step dt, not number of calls
c
c ./fem3d/basutil.f:
! 21.03.2017	ggu	new flag area to compute area/vol on area code
!
c ./fem3d/ouselab1.f:
c 21.03.2017    ggu     mode to avermode, min/max now working (new initialization)
c
c ./fem3d/new3di.f:
c 24.03.2017    ggu	new treatment for afix in sp256v_intern()
c
c ./fem3d/subver.f:
c 31.03.2017	ggu	version 7.5.24
c
c ./fem3d/subnev.f:
c 29.03.2017	ggu	xi2xy changed to correct for small det
c
c ./fem3d/suboff.f:
c 29.03.2017    ggu     bug fix - input file opened on unit 1
c
c ./fem3d/shybas.f:
C 21.03.2017    ggu     new routine to compute area/vol on area code
c
c ./fem3d/shyutil.f:
! 21.03.2017    ggu     use new values for initialization of accum
! 21.03.2017    ggu     computation of std revised (no NaNs)

==========================================================

version  7_5_23    13-02-2017    VERS_7_5_23   commit_2017-03-31

version  7_5_23    13-02-2017    VERS_7_5_23   commit_2017-03-24

version  7_5_23    13-02-2017    VERS_7_5_23   commit_2017-03-24

version  7_5_23    13-02-2017    VERS_7_5_23   commit_2017-02-14

version  7_5_23    13-02-2017    VERS_7_5_23

========================================================== 13-02-2017 - 7_5_23

c ./fem3d/subver.f:
c 13.02.2017	ggu	version 7.5.23
c
c ./fem3d/subnsa.f:
c 02.02.2017	ggu	nlsa simplified
c
c ./fem3d/subshyutil.f:
! 02.02.2017    ggu     new routine shy_print_descriptions()
c
c ./fem3d/sedi3d.f:
c 10.02.2017    ggu     read in init data from fem files
c
c ./fem3d/subgrd.f:
c 10.02.2017    ggu     bug fix: do not allocate at least 1 array element
c
c ./fem3d/newconz.f:
c 13.02.2017    mic     idecay has new meaning!!! (incompatible)
c
c ./fem3d/subssed.f:
! 03.02.2017	ggu	old routine copied from subcus.f

==========================================================

version  7_5_22    20-01-2017    VERS_7_5_22   commit_2017-02-13

version  7_5_22    20-01-2017    VERS_7_5_22   commit_2017-02-13

version  7_5_22    20-01-2017    VERS_7_5_22   commit_2017-02-10

version  7_5_22    20-01-2017    VERS_7_5_22   commit_2017-02-03

version  7_5_22    20-01-2017    VERS_7_5_22   commit_2017-02-03

version  7_5_22    20-01-2017    VERS_7_5_22   commit_2017-01-25

version  7_5_22    20-01-2017    VERS_7_5_22

========================================================== 20-01-2017 - 7_5_22

c ./fem3d/subver.f:
c 20.01.2017	ggu	version 7.5.22	God bless America's release '

==========================================================

version  7_5_21    12-01-2017    VERS_7_5_21   commit_2017-01-20

version  7_5_21    12-01-2017    VERS_7_5_21

========================================================== 12-01-2017 - 7_5_21

c ./femplot/shyplot.f:
! 31.10.2016    ggu     shyplot restructured... directional plot still broken
c
c ./femplot/suplin.f:
c 27.10.2016    ccf     use hkv for smooth bottom
c
c ./fem3d/subflxu.f:
c 26.10.2016    ccf     bug fix in flxsec
c
c ./fem3d/femelab.f:
! 31.10.2016    ggu     new flag condense (bcondense)
c
c ./fem3d/subres.f:
c 31.10.2016    ggu     new output format in rms files
c
c ./fem3d/newtvd.f:
c 31.10.2016	ggu	initialization made faster
c
c ./fem3d/newcon.f:
c 20.10.2016    ccf     pass rtauv for differential nudging
c
c ./fem3d/new3di.f:
c 31.10.2016    ggu	parallel part modified
c
c ./fem3d/subwrt.f:
c 31.10.2016	ggu	new output format for wrt files
c
c ./fem3d/subver.f:
c 12.01.2017	ggu	version 7.5.21
c
c ./fem3d/submeteo2.f:
c 12.01.2017    ccf	bug fix in determining pressure units
c
c ./fem3d/newstab.f:
c 20.10.2016    ccf     pass rtauv for differential nudging
c
c ./fem3d/subcus.f:
c 21.10.2016	ccf	set ttauv and stauv for med-mar-bla
c
c ./fem3d/newcon_omp.f:
c 20.10.2016    ccf     pass rtauv for differential nudging

==========================================================

version  7_5_20    11-10-2016    VERS_7_5_20   commit_2017-01-12

version  7_5_20    11-10-2016    VERS_7_5_20   commit_2016-11-18

version  7_5_20    11-10-2016    VERS_7_5_20   commit_2016-11-08

version  7_5_20    11-10-2016    VERS_7_5_20   commit_2016-11-08

version  7_5_20    11-10-2016    VERS_7_5_20   commit_2016-11-04

version  7_5_20    11-10-2016    VERS_7_5_20

========================================================== 11-10-2016 - 7_5_20

c ./fem3d/femelab.f:
! 11.10.2016    ggu     introduced flag for min/max/med computation
c
c ./fem3d/subfemintp.f:
! 11.10.2016	ggu	new routine iff_extend_vertically() for reg interp
!
c ./fem3d/subver.f:
c 11.10.2016	ggu	version 7.5.20

==========================================================

version  7_5_19    05-10-2016    VERS_7_5_19   commit_2016-10-11

version  7_5_19    05-10-2016    VERS_7_5_19

========================================================== 05-10-2016 - 7_5_19

c ./fem3d/femelab.f:
! 04.10.2016    ggu     output flags now similar to shyelab
! 05.10.2016    ggu     allow for expansion of regular grid
c
c ./fem3d/subver.f:
c 05.10.2016	ggu	version 7.5.19
c
c ./fem3d/elab_regular.f:
! 05.10.2016    ggu     routines dealing with regular field copied to own file
c
c ./fem3d/shyelab_output.f:
! 05.10.2016    ggu     routines dealing with regular field copied to own file
!
c ./fem3d/bio3d.f:
c 05.10.2016    ggu     init conditions can now be set from file (bioin,biosin)
c
c ./fem3d/subfemfile.f:
c 05.10.2016	ggu	routine to clean data from NaNs
c
c ./fem3d/shyutil.f:
! 05.10.2016    ggu     use zeps for computing volumes

==========================================================

version  7_5_18    30-09-2016    VERS_7_5_18   commit_2016-10-05

version  7_5_18    30-09-2016    VERS_7_5_18

========================================================== 30-09-2016 - 7_5_18

c ./femplot/supano.f:
c 13.09.2016  ggu     old legend deleted, new keyword ctxt for centering
c
 * ./post/psgraphf.c:
 * 14-Sep-2016: code to ignore underscore				*
c ./fem3d/subver.f:
c 30.09.2016	ggu	version 7.5.18
c
c ./fem3d/subbas.f:
c 23.09.2016	ggu	new routines to check if basin has been read
c
c ./fem3d/subreg.f:
c 23.09.2016	ggu	allow for eps in computing box and reg intp
c
c ./fem3d/submeteo2.f:
c 16.09.2016    ggu	allow for Pa and mbar in pressure
c
c ./fem3d/shyelab_output.f:
! 23.09.2016    ggu     expand routine written
!
c ./fem3d/bio3d.f:
c 14.09.2016    ggu     small bug fix for shy output
c 16.09.2016    dmc     comments on eseed. Seeding is set in weutro_seed.f
c
c ./fem3d/subtime.f:
c 23.09.2016    ggu     cleaned set_timestep()

==========================================================

version  7_5_17    09-09-2016    VERS_7_5_17   commit_2016-09-30

version  7_5_17    09-09-2016    VERS_7_5_17   commit_2016-09-29

version  7_5_17    09-09-2016    VERS_7_5_17   commit_2016-09-23

version  7_5_17    09-09-2016    VERS_7_5_17   commit_2016-09-14

version  7_5_17    09-09-2016    VERS_7_5_17

========================================================== 09-09-2016 - 7_5_17

c ./fem3d/elabutil.f:
! 08.09.2016	ggu	new options -map, -info, -areas, -dates
!
c ./fem3d/subvintp.f:
c 28.06.2016    ggu     bug fix: handel situation with dh == 0
c
c ./fem3d/newfix.f:
c 13.07.2016    ivf     bug fix setting up ielfix
c
c ./fem3d/noselab1.f:
c 08.09.2016    ggu     some minor changes, map_influence, custom dates
c
c ./fem3d/shyelab1.f:
! 08.09.2016    ggu     custom dates, map_influence
c
c ./fem3d/newconz.f:
c 08.09.2016    ggu     new decay function implemented (chapra), cleaned
c
c ./fem3d/subver.f:
c 09.09.2016	ggu	version 7.5.17	after holiday release... sniff
c
c ./fem3d/submeteo2.f:
c 23.07.2016    ivf	new heat formulation for iheat==8
c 09.09.2016    ggu	new variable ihtype to choose between rh, wbt, dpt
c
c ./fem3d/newbfm.f:
c 28.06.2016    ggu         initialize bfmv, new routine bfm_check()
c
c ./fem3d/subqfxu1.f:
c 09.09.2016    ggu     new routine convert_vapor_content()
c
c ./fem3d/shyutil.f:
! 08.09.2016    ggu     new flag bforce to force output

==========================================================

version  7_5_16    27-06-2016    VERS_7_5_16   commit_2016-09-09

version  7_5_16    27-06-2016    VERS_7_5_16

========================================================== 27-06-2016 - 7_5_16

c ./fem3d/subfemintp.f:
! 23.06.2016	ggu	tested usage of pointer
!
c ./fem3d/subssv.f:
c 19.06.2016    ggu	new routine aver, some other routines deleted
c
c ./fem3d/weutro_seed.f:
c 17.06.2016	dmk	last changes integrated
c
c ./fem3d/weutro.f:
c 17.06.2016    dmc     deleted rlux, link for shyfem 7_5_13
c
c ./fem3d/subver.f:
c 27.06.2016	ggu	version 7.5.16	Mutti's birthday release '
c
c ./fem3d/subreg.f:
c 23.06.2016	ggu	allow for eps in computing box
c
c ./fem3d/bio3d.f:
c 17.06.2016    dmc     light from shyfem get_light (Watt/m2) 
c 17.06.2016    dmc     link to shyfem 7_5_13 
c 23.06.2016    ggu     bug fix: forgot to initialize eload
c
c ./fem3d/subshy.f:
! 17.06.2016    ggu     inserted error check for compatibility
!
c ./fem3d/newbcl.f:
c 27.06.2016    ggu     bug fix: irho was not saved

==========================================================

version  7_5_15    17-06-2016    VERS_7_5_15   commit_2016-06-27

version  7_5_15    17-06-2016    VERS_7_5_15

========================================================== 17-06-2016 - 7_5_15

c ./femplot/col.f:
c 15.06.2016    ggu     adjcoltab deleted
c
c ./femplot/supano.f:
c 17.06.2016  ccf     include kn units and correct date/time for tzshow
c
c ./fem3d/newnohydro.f:
c 17.06.2016    ggu&wjm adapted to new version
c
c ./fem3d/subnsh.f:
c 16.06.2016    wjm     added check for section nonhyd 
c
c ./fem3d/subfemintp.f:
! 16.06.2016	ggu	new routine to check nvar: iff_get_file_nvar()
!
c ./fem3d/arc/newnohydro_real.f:
c 15.06.2016    wjm     modified
c
c ./fem3d/mod_hydro_print.f:
! 17.06.2016    ggu     wprv is now from 1:nlv
!
!============================================================
c
c ./fem3d/subver.f:
c 17.06.2016	ggu	version 7.5.15	Italy-Sweden release
c
c ./fem3d/newtra.f:
c 17.06.2016	ggu	adjust code to reflect that wprv now starts from 1

==========================================================

version  7_5_14    14-06-2016    VERS_7_5_14   commit_2016-06-17

version  7_5_14    14-06-2016    VERS_7_5_14

========================================================== 14-06-2016 - 7_5_14

c ./femplot/shyplot.f:
! 13.06.2016    ggu     shyplot now plots barotropic vars (layer==0)
c
c ./fem3d/shyelab1.f:
! 10.06.2016    ggu     shydiff included
c
c ./fem3d/subver.f:
c 14.06.2016	ggu	version 7.5.14
c
c ./fem3d/newexpl.f:
c 14.06.2016	dbf	diff. vertical momentum advection schemes implemented
c
c ./fem3d/newbcl.f:
c 14.06.2016    ggu     open and write of file in own subroutine

==========================================================

version  7_5_13    10-06-2016    VERS_7_5_13   commit_2016-06-14

version  7_5_13    10-06-2016    VERS_7_5_13

========================================================== 10-06-2016 - 7_5_13

c ./femplot/shyplot.f:
! 10.06.2016    ggu     shyplot now plots fem files
c
c ./fem3d/subfemintp.f:
! 07.06.2016	ggu	check if file has desired number of variables nvar
! 08.06.2016	ggu	handle case where no depth is given in file and sigma
! 09.06.2016	ggu	integrate_vertical eliminated (use interpolate)
! 10.06.2016	ggu	handle iff_init() call with nvar == 0
!
c ./fem3d/subnsa.f:
c 07.06.2016	ggu	use both varid and varname to decide on section reading
c
c ./fem3d/newconz.f:
c 10.06.2016    ggu     some more re-formatting
c
c ./fem3d/subver.f:
c 10.06.2016	ggu	version 7.5.13
c
c ./fem3d/subbas.f:
c 10.06.2016	ggu	new routine for inserting regular grid
c
c ./fem3d/newbcl.f:
c 10.06.2016    ggu     not used routines deleted

==========================================================

version  7_5_12    07-06-2016    VERS_7_5_12   commit_2016-06-10

version  7_5_12    07-06-2016    VERS_7_5_12

========================================================== 07-06-2016 - 7_5_12

c ./fem3d/subgrd.f:
c 06.06.2016    ggu     bstop substituted with berr, new accessor routines
c
c ./fem3d/subtsuvfile.f:
c 06.06.2016    ggu	tracer_file routines changed
c
c ./fem3d/netcdf.f:
c 31.05.2016    ggu	changed time variable to double precision
c
c ./fem3d/subclo.f:
! 01.06.2016    ggu     new routine clo_hide_option() and -hh,-fullhelp
!
c ./fem3d/newconz.f:
c 06.06.2016    ggu     initialization from file changed
c
c ./fem3d/subver.f:
c 06.06.2016	ggu	version 7.5.12	Monika's 70th birthday release '
c
c ./fem3d/sublin.f:
c 06.06.2016    ggu     module added, new routines for bnd and grd lines
c
c ./fem3d/newbfm.f:
c 06.06.2016    ggu         initialization from file changed

==========================================================

version  7_5_11    30-05-2016    VERS_7_5_11   commit_2016-06-07

version  7_5_11    30-05-2016    VERS_7_5_11

========================================================== 30-05-2016 - 7_5_11

c ./femplot/supdep.f:
c 27.05.2016    ggu     mkhkv,mkhev deleted
c
c ./femplot/suplin.f:
c 27.05.2016    ggu     some restructuring to lower dependencies
c
c ./fem3d/subnsh.f:
c 26.05.2016    ggu     new check for sections: count_sections()
c
c ./fem3d/newini.f:
c 30.05.2016    ggu	changes in set_last_layer(), possible bug fix ilytyp==1
c
c ./fem3d/subclo.f:
! 30.05.2016    ggu     new routine clo_add_com() (identical to clo_add_sep)
!
c ./fem3d/subver.f:
c 30.05.2016	ggu	version 7.5.11	Clara's birthday release '
c
c ./fem3d/subshyutil.f:
! 26.05.2016    ggu     new routines for opening and writing scalar file

==========================================================

version  7_5_10    25-05-2016    VERS_7_5_10   commit_2016-05-30

version  7_5_10    25-05-2016    VERS_7_5_10

========================================================== 25-05-2016 - 7_5_10

c ./fem3d/mercury.f:
c 15.05.2016    ggu     started mercury from bio3d
c
c ./fem3d/subres.f:
c 17.05.2016    ggu     in ts_shell() save isvect/itvect
c
c ./fem3d/subfemintp.f:
! 05.05.2016	ggu	new functionality for 3d matrices
!
c ./fem3d/basutil.f:
! 01.05.2016	ggu	new routine to convert depth from node to elem
!
c ./fem3d/subqfxu4.f:
c 04.05.2016    ccf     do not pass albedo into heat2t
c
c ./fem3d/subver.f:
c 25.05.2016	ggu	version 7.5.10	for Leslie
c
c ./fem3d/subbas.f:
c 01.05.2016	ggu	new routines basin_has_basin()
c 20.05.2016	ggu	estimate_ngr() returns exact ngr
c
c ./fem3d/subreg.f:
c 05.05.2016	ggu	file restructured (module)
c
c ./fem3d/sigmautil.f:
c 01.05.2016	ggu	changes in get_layer_thickness(): exit from loop
c 14.05.2016	ggu	substitute blockdata/common with module
c
c ./fem3d/newtra.f:
c 19.05.2016	ggu	use where construct where possible
c
c ./fem3d/subqfxt.f:
c 04.05.2016    ccf     do not pass albedo into heat2t
c 04.05.2016    ggu     include effect of ice cover
c
c ./fem3d/subfemfile.f:
c 13.05.2016	ggu	nvers = 3 -> add data size to records
c 14.05.2016	ggu	new module to collect global parameters

==========================================================

version  7_5_9    28-04-2016    VERS_7_5_9   commit_2016-05-25

version  7_5_9    28-04-2016    VERS_7_5_9

========================================================== 28-04-2016 - 7_5_9

c ./fem3d/nos2nc.f:
c 27.04.2016    mbj     adapted to new framework
c
c ./fem3d/subver.f:
c 28.04.2016	ggu	version 7.5.9
c
c ./fem3d/ous2nc.f:
c 27.04.2016    mbj     adapted to new framework

==========================================================

version  7_5_8    15-04-2016    VERS_7_5_8   commit_2016-04-28

version  7_5_8    15-04-2016    VERS_7_5_8

========================================================== 15-04-2016 - 7_5_8

c ./fem3d/elabutil.f:
! 15.04.2016	ggu	handle gis files with substitution of colon
!
c ./fem3d/subfemintp.f:
! 01.04.2016	ggu	bug fix in iff_init(): open file with np and not nexp
!
c ./fem3d/basutil_interp.f:
c 11.04.2016    ggu     meaning of ufact has changed, expo interp working
c
c ./fem3d/basutil_bathy.f:
c 11.04.2016    ggu     meaning of ufact has changed
c
c ./fem3d/newnudge.f:
c 15.04.2016    ggu     started cleaning module
c
c ./fem3d/subwaves.f:
! 15.04.2016	ggu	parametric wave module cleaned
!
c ./fem3d/nos2nc.f:
c 15.04.2016    ggu     ndim eliminated (allocatable)
c
c ./fem3d/subwrt.f:
c 15.04.2016	ggu	new input file for custom reset
c
c ./fem3d/feminf.f:
! 07.04.2016    ggu     option node added to extract value at node
c
c ./fem3d/subver.f:
c 15.04.2016	ggu	version 7.5.8	after 20th anniversary
c
c ./fem3d/newtra.f:
c 07.04.2016	ggu	new routine aver_nodal()
c
c ./fem3d/subflxa.f:
c 12.04.2016    ggu     fluxes_template adjourned
c 15.04.2016    ggu     fluxes_template debugged and finished
c
c ./fem3d/flxinf.f:
c 07.04.2016	ggu	bug fix for allocation of arrays
c
c ./fem3d/subspk.f:
c 04.04.2016    ggu	make some big arrays allocatable and not on stack
c
c ./fem3d/subsys.f:
c 05.04.2016	ggu	new parameter iaicef for ice free areas
c
c ./fem3d/subqfxt.f:
c 07.04.2016    ggu     compute total evaporation

==========================================================

version  7_5_7    01-04-2016    VERS_7_5_7   commit_2016-04-15

version  7_5_7    01-04-2016    VERS_7_5_7

========================================================== 01-04-2016 - 7_5_7

c ./fem3d/newcon.f:
c 01.04.2016    ggu     most big arrays moved from stack to allocatable
c
c ./fem3d/mod_bnd.f:
! 01.04.2016    ggu     parameter and file names transfered to here
!
c ./fem3d/subver.f:
c 01.04.2016	ggu	version 7.5.7	no April joke
c
c ./fem3d/subetsa.f:
c 01.04.2016    ggu     bug fix for waves
c
c ./fem3d/subbnd.f:
c 01.04.2016    ggu	restructured - arrays transfered to mod_bnd.f
c
c ./fem3d/sedi3d.f:
c 01.04.2016    ccf&ggu adapted to new model version

==========================================================

version  7_5_6    22-03-2016    VERS_7_5_6   commit_2016-04-01

version  7_5_6    22-03-2016    VERS_7_5_6

========================================================== 22-03-2016 - 7_5_6

 * ./mesh/exgrd.c:
 * 18-Mar-2016: -a option also changes versus in line			*
 * ./mesh/meshfi.c:
 * 19-Mar-2016: program now accepts filename with and without .grd	*
c ./fem3d/ouselab1.f:
c 17.03.2016    ggu     outformat git added
c
c ./fem3d/subver.f:
c 22.03.2016	ggu	version 7.5.6	Alessandra's birthday release '
c
c ./fem3d/shybas.f:
c 17.03.2016    ggu     new routine write_depth_from_bas()

==========================================================

version  7_5_5    11-03-2016    VERS_7_5_5   commit_2016-03-22

version  7_5_5    11-03-2016    VERS_7_5_5

========================================================== 11-03-2016 - 7_5_5

c ./fem3d/subfemintp.f:
! 07.03.2016	ggu	bug fix in iff_read_header(): no time adjust if ierr/=0
!
c ./fem3d/subwaves.f:
! 10.03.2016	ggu	in parametric wave module fix segfault (allocatable)
!
c ./fem3d/new3di.f:
c 10.03.2016    ggu	in sp256v_intern() b/cpres in double precision
c 11.03.2016    ggu	most variables passed in double precision
c
c ./fem3d/subver.f:
c 11.03.2016	ggu	version 7.5.5
c
c ./fem3d/submeteo2.f:
c 10.03.2016    ggu	check for pressure to be in reasonable bounds

==========================================================

version  7_5_4    22-02-2016    VERS_7_5_4   commit_2016-03-11

version  7_5_4    22-02-2016    VERS_7_5_4

========================================================== 22-02-2016 - 7_5_4

c ./fem3d/elabutil.f:
! 22.02.2016	ggu	handle catmode
!
c ./fem3d/subtsuvfile.f:
c 22.02.2016    ggu&eps new files for generic tracer (nvar>1)
c
c ./fem3d/noselab1.f:
c 22.02.2016    ggu     handle catmode
c
c ./fem3d/subver.f:
c 22.02.2016	ggu	version 7.5.4
c
c ./fem3d/subbnd.f:
c 22.02.2016    ggu	new files bfmbcn integrated
c
c ./fem3d/subsys.f:
c 22.02.2016	ggu	new file for initial conditions bfmini
c
c ./fem3d/newbfm.f:
c 22.02.2016    ggu&eps     new bfm routines created from newconz

==========================================================

version  7_5_3    19-02-2016    VERS_7_5_3   commit_2016-02-22

version  7_5_3    19-02-2016    VERS_7_5_3

========================================================== 19-02-2016 - 7_5_3

c ./fem3d/noselab1.f:
c 19.02.2016    ggu     bug fixes for bsumvar and mode==2 (sum)
c
c ./fem3d/subver.f:
c 19.02.2016	ggu	version 7.5.3
c
c ./fem3d/mod_conz.f:
! 19.02.2016    ggu     set default decay to zero

==========================================================

version  7_5_2    19-02-2016    VERS_7_5_2   commit_2016-02-19

version  7_5_2    19-02-2016    VERS_7_5_2

========================================================== 19-02-2016 - 7_5_2

c ./fem3d/subnls.f:
c 01.02.2016	ggu	bug in nls_insert_variable() -> new char variable
c
c ./fem3d/subfemintp.f:
! 15.02.2016	ggu	if dtime==-1 do not check time, changes in exffil
!
c ./fem3d/lagrange_vertical.f:
c 15.02.2016    ggu     handle particles on vertical wall gracefully
c
c ./fem3d/lagrange_init.f:
c 15.02.2016    ggu	handle negative areas (line given clockwise)
c
c ./fem3d/subwrt.f:
c 01.02.2016	ggu	implemented custom reset
c
c ./fem3d/subver.f:
c 19.02.2016	ggu	version 7.5.2
c
c ./fem3d/subnev.f:
c 15.02.2016	ggu	more debug code, assure xi is in bounds
c
c ./fem3d/subsys.f:
c 01.02.2016	ggu	some plot params shifted to para section (bbgray, etc.)
c
c ./fem3d/lagrange_inout.f:
c 15.02.2016    ggu&fra	new release type ipvert=-1

==========================================================

version  7_5_1    22-01-2016    VERS_7_5_1   commit_2016-02-19

version  7_5_1    22-01-2016    VERS_7_5_1

========================================================== 22-01-2016 - 7_5_1

c ./fem3d/subver.f:
c 22.01.2016	ggu	version 7.5.1
c
c ./fem3d/subspk.f:
c 13.01.2016    ggu&ivn bug in allocation of rvec and raux (n instead nndim)
c
c ./fem3d/subfemfile.f:
c 21.01.2016	ggu	read and write string without leading blanks
c
c ./fem3d/subqfxm5.f:
! 22.01.2016    ggu     bug fix for COARE integrated (L gets infinite)

==========================================================

version  7_5_0    08-01-2016    VERS_7_5_0   commit_2016-01-22

version  7_5_0    08-01-2016    VERS_7_5_0

========================================================== 08-01-2016 - 7_5_0

c ./fem3d/subver.f:
c 08.01.2016	ggu	version 7.5.0	new develop version opened

==========================================================

version  7_4_0    08-01-2016    VERS_7_4_0   commit_2016-01-08

version  7_4_0    08-01-2016    VERS_7_4_0

========================================================== 08-01-2016 - 7_4_0

c ./fem3d/subver.f:
c 08.01.2016	ggu	version 7.4.0	major stable version

==========================================================

version  7_3_18    08-01-2016    VERS_7_3_18   commit_2016-01-08

version  7_3_18    08-01-2016    VERS_7_3_18

========================================================== 08-01-2016 - 7_3_18

c ./fem3d/submeteo2.f:
c 08.01.2016    ggu	bug fix in meteo_convert_wind_data() - no wind bug
c
c ./fem3d/subver.f:
c 08.01.2016	ggu	version 7.3.18

==========================================================

version  7_3_17    18-12-2015    VERS_7_3_17   commit_2016-01-08

version  7_3_17    18-12-2015    VERS_7_3_17

========================================================== 18-12-2015 - 7_3_17

 * ./grid/gridma1.c:
 * 17-Dec-2015: delete node only if use is 0				*
c ./fem3d/subver.f:
c 16.12.2015	ggu	version 7.3.16
c 18.12.2015	ggu	version 7.3.17	Christmas 2015 release
c
c ./fem3d/basutil_interp.f:
c 16.12.2015	ggu	depth ht is now passed in for square interpol
c
c ./fem3d/subfemintp.f:
! 18.12.2015	ggu	in iff_peek_next_record() adjust date only if ierr==0
!
c ./fem3d/basutil_bathy.f:
c 16.12.2015    ggu     depth ht is now passed in for square interpol

==========================================================

version  7_3_16    16-12-2015    VERS_7_3_16   commit_2015-12-18

version  7_3_16    16-12-2015    VERS_7_3_16

========================================================== 16-12-2015 - 7_3_16

c ./femplot/suplin.f:
c 02.12.2015    ggu     bug fix in integrate_flux() - dx was used twice
c
c ./fem3d/simsys_spk.f:
! 09.12.2015	ggu	adapted to new pointers and 3d matrix
! 15.12.2015	ggu&deb	finsihed and validated
c
c ./fem3d/newtra.f:
c 03.12.2015	ccf&ggu	code optimized
c
c ./fem3d/mod_system.f:
! 15.12.2015    ggu&deb     adapted to 3d case (poisson)
!
c ./fem3d/simsys_pard.f:
c 15.12.2015    deb     adjusted for new 3d framework
c
c ./fem3d/subrst.f:
! 30.11.2015    ggu     allocate cnv/conzv before read
!
c ./fem3d/subver.f:
c 20.11.2015	ggu	version 7.3.16
c
c ./fem3d/subgotm.f:
c 03.12.2015    ccf     levdbg introduced for checka
c
c ./fem3d/newpoi.f:
! 15.12.2015    ggu&deb&wmk     written from scratch
!
c ./fem3d/simsys_lp.f:
c 15.12.2015	ggu	added dummy subroutines for 3d case
c
c ./fem3d/subspk.f:
c 15.12.2015    ggu&deb adapted to new 3d framework
c
c ./fem3d/subpard.f:
c 15.12.2015    deb     adjusted for new 3d framework
c
c ./fem3d/sublnku.f:
c 02.12.2015	ggu	lnk_elems and lnk_nodes eliminated
c
c ./fem3d/mod_bnd.f:
! 01.12.2015    ggu     ready to accept no open boundary (bug fix)
!
c ./fem3d/links.f:
c 02.12.2015    ggu	routines get_link() and get_lenk() deleted
c
c ./fem3d/subproj.f:
! 03.12.2015    ggu     bug fix because arrays were defined length 1
!
c ./fem3d/arc/mod_shympi.f:
! 24.11.2015    ggu     project started
!
c ./fem3d/subcoo.f:
c 04.12.2015    ggu     new approach for constructing matrix - also 3d
c 15.12.2015    ggu&deb finished and validated 3d approach

==========================================================

version  7_3_15    20-11-2015    VERS_7_3_15   commit_2015-12-16

version  7_3_15    20-11-2015    VERS_7_3_15

========================================================== 20-11-2015 - 7_3_15

c ./fem3d/subver.f:
c 20.11.2015	ggu	version 7.3.15	pre Madonna della Salute release
c
c ./fem3d/new3di.f:
c 20.11.2015    ggu&erp chunk size introduced, omp finalized
c
c ./fem3d/newcon_omp.f:
c 20.11.2015    ggu&erp chunk size introduced, omp finalized

==========================================================

version  7_3_14    16-11-2015    VERS_7_3_14   commit_2015-11-20

version  7_3_14    16-11-2015    VERS_7_3_14

========================================================== 16-11-2015 - 7_3_14

c ./fem3d/subver.f:
c 16.11.2015	ggu	version 7.3.14
c
c ./fem3d/subnev.f:
c 16.11.2015	ggu	new routine adjust_xi()

==========================================================

version  7_3_13    09-11-2015    VERS_7_3_13   commit_2015-11-16

version  7_3_13    09-11-2015    VERS_7_3_13

========================================================== 09-11-2015 - 7_3_13

c ./femplot/supsim.f:
c 06.11.2015    ggu	set valref to 1 if vel field == 0
c
c ./fem3d/mod_conz.f:
! 09.11.2015    ggu     restructured with global values
!
c ./fem3d/subver.f:
c 09.11.2015	ggu	version 7.3.13	the wall release
c
c ./fem3d/newconz.f:
c 09.11.2015    ggu     newly structured in init, compute and write

==========================================================

version  7_3_12    05-11-2015    VERS_7_3_12   commit_2015-11-09

version  7_3_12    05-11-2015    VERS_7_3_12

========================================================== 05-11-2015 - 7_3_12

c ./fem3d/subver.f:
c 05.11.2015	ggu	version 7.3.12

==========================================================

version  7_3_11    05-11-2015    VERS_7_3_11   commit_2015-11-05

version  7_3_11    05-11-2015    VERS_7_3_11

========================================================== 05-11-2015 - 7_3_11

c ./fem3d/newnudge.f:
c 04.11.2015    ggu     bug in velocitiy nudging fixed
c
c ./fem3d/suboutput.f:
c 04.11.2015    ggu     allow for initial output in adjust_itmidt()
c
c ./fem3d/subrst.f:
! 30.10.2015    ggu     new names, restructured
!
c ./fem3d/subver.f:
c 05.11.2015	ggu	version 7.3.11
c
c ./fem3d/suboutputd.f:
c 04.11.2015    ggu     allow for initial output in adjust_itmidt()
c
c ./fem3d/femelab.f:
! 05.11.2015    ggu     new option chform to change format
c
c ./fem3d/suboff.f:
c 05.11.2015    ggu     revisited and checked
c
c ./fem3d/newini.f:
c 05.11.2015    ggu	can now initialize z,u,v from file

==========================================================

version  7_3_10    26-10-2015    VERS_7_3_10   commit_2015-11-05

version  7_3_10    26-10-2015    VERS_7_3_10

========================================================== 26-10-2015 - 7_3_10

c ./fem3d/subver.f:
c 26.10.2015	ggu	version 7.3.10
c
c ./fem3d/newcon.f:
c 26.10.2015    ggu     critical omp sections introduced (eliminated data race)
c 26.10.2015    ggu     mass check only for levdbg > 2
c
c ./fem3d/newbcl.f:
c 26.10.2015    ggu     bug fix for parallel code (what was not set)
c
c ./fem3d/subqfxt.f:
c 26.10.2015    ggu     critical omp sections introduced (eliminated data race)

==========================================================

version  7_3_9    23-10-2015    VERS_7_3_9   commit_2015-10-26

version  7_3_9    23-10-2015    VERS_7_3_9

========================================================== 23-10-2015 - 7_3_9

c ./fem3d/subver.f:
c 23.10.2015	ggu	version 7.3.9	after Eric

==========================================================

version  7_3_8    22-10-2015    VERS_7_3_8   commit_2015-10-23

version  7_3_8    22-10-2015    VERS_7_3_8

========================================================== 22-10-2015 - 7_3_8

c ./fem3d/subver.f:
c 22.10.2015	ggu	version 7.3.8	Tante Lores birthday release again

==========================================================

version  7_3_7    22-10-2015    VERS_7_3_7

========================================================== 22-10-2015 - 7_3_7

c ./fem3d/suboutput.f:
c 20.10.2015    ggu     new routines to set/get unit
c
c ./fem3d/subrst.f:
c 20.10.2015    ggu     bug fix to get correct restart time (itanf)
c
c
c ./fem3d/subver.f:
c 22.10.2015	ggu	version 7.3.7	Tante Lores birthday release
c
c ./fem3d/suboutputd.f:
c 20.10.2015    ggu     new routines to set/get id
c
c ./fem3d/newstab.f:
c 20.10.2015    ggu	in output_stability() bug that icall was not adjouned

==========================================================

version  7_3_6    19-10-2015    VERS_7_3_6   commit_2015-10-22

version  7_3_6    19-10-2015    VERS_7_3_6

========================================================== 19-10-2015 - 7_3_6

c ./fem3d/subousa.f:
c 15.10.2015	ggu	added new calls for shy file format
c
c ./fem3d/subshy.f:
! 15.10.2015    ggu     completed basic parts
!
c ./fem3d/subver.f:
c 19.10.2015	ggu	version 7.3.6
c
c ./fem3d/subshyutil.f:
! 15.10.2015    ggu     started routine
c
c ./fem3d/newbcl.f:
c 15.10.2015    ggu     added new calls for shy file format
c
c ./fem3d/shyelab1.f:
! 16.10.2015    ggu     started shyelab

==========================================================

version  7_3_5    13-10-2015    VERS_7_3_5   commit_2015-10-19

version  7_3_5    13-10-2015    VERS_7_3_5

========================================================== 13-10-2015 - 7_3_5

c ./fem3d/subver.f:
c 13.10.2015	ggu	version 7.3.5

==========================================================

version  7_3_4a    12-10-2015    VERS_7_3_4a   commit_2015-10-13

version  7_3_4a    12-10-2015    VERS_7_3_4a

========================================================== 12-10-2015 - 7_3_4a

c ./fem3d/subver.f:
c 12.10.2015	ggu	version 7.3.4a

==========================================================

version  7_3_4    12-10-2015    VERS_7_3_4

========================================================== 12-10-2015 - 7_3_4

c ./fem3d/subver.f:
c 12.10.2015	ggu	version 7.3.4

==========================================================

version  7_3_3    12-10-2015    VERS_7_3_3   commit_2015-10-12

version  7_3_3    12-10-2015    VERS_7_3_3

========================================================== 12-10-2015 - 7_3_3

c ./femplot/supbas.f:
c 12.10.2015  ggu     fix in rround() to handle rmaster==0 case
c
c ./fem3d/subtime.f:
c 10.10.2015    ggu     use bsync as global to check for syncronization
c
c ./fem3d/subflx.f:
c 10.10.2015	ggu	new routines for new flx framework
c
c ./fem3d/subnev.f:
c 10.10.2015	ggu	bug fix in adjust_bc() - brown paper bag bug
c
c ./fem3d/shyfem.f:
c 10.10.2015    ggu	fluid mud routines handled differently
c
c ./fem3d/elabutil.f:
! 10.10.2015	ggu	code added to handle FLX routines
!
c ./fem3d/subver.f:
c 12.10.2015	ggu	version 7.3.3
c
 * ./post/psgraphf.c:
 * 11-Oct-2015: new routines qopenfile to open with given file name	*
c ./tmp/subshy.f:
! 10.10.2015    ggu     started routine
!
c ./femadj/adj5el.f:
c 11.10.2015    ggu     bug fix: fused node was not moved

==========================================================

version  7_3_2    10-10-2015    VERS_7_3_2

========================================================== 10-10-2015 - 7_3_2

c ./fem3d/subproj.f:
! 30.09.2015    ccf     introduced module projection
!
c ./fem3d/subbas.f:
c 02.10.2015	ggu	in basin_open_file eliminated double read (bug)
c 02.10.2015	ggu	new routines is_depth_unique(), estimate_ngr()
c
c ./fem3d/shybas.f:
c 30.09.2015    ggu     shybas started
c 01.10.2015    ggu     shybas nearly finished
c 02.10.2015    ggu     only basproj is missing
c
c ./fem3d/subcoord.f:
! 30.09.2015    ccf     introduced module coordinates
!
c ./fem3d/subgrd.f:
c 02.10.2015    ggu     new routine is_grd_file()
c 02.10.2015    ggu     now stopping on first error
c
c ./fem3d/basutil.f:
! 01.10.2015	ggu	converted to basutil
!
c ./fem3d/subver.f:
c 02.10.2015	ggu	version 7.3.1	first of development branch
c 10.10.2015	ggu	version 7.3.2
c
c ./fem3d/subtidef.f:
! 30.09.2015    ccf     converted previous routines to module
! 01.10.2015    ccf     bug fix in hour, now handle negative time

==========================================================

version  7_2_6    30-09-2015    VERS_7_2_6   commit_2015-10-10

version  7_2_6    30-09-2015    VERS_7_2_6

========================================================== 30-09-2015 - 7_2_6

c ./fem3d/subbnds.f:
c 30.09.2015    ggu     new routine iff_flag_ok() for ambient value
c
c ./fem3d/subver.f:
c 30.09.2015	ggu	version 7.2.6
c
c ./fem3d/newcon.f:
c 30.09.2015    ggu     routine cleaned, no reals in conz3d
c
c ./fem3d/optintp.f:
c 29.09.2015	ggu	move some vars to custimize to the beginning of file
c
c ./fem3d/mod_subset.f:
c 29.09.2015	ggu	new routine which is much faster
c 30.09.2015	ggu	new routine domain_clusterization_dummy()
c
c ./fem3d/newcon_omp.f:
c 30.09.2015    ggu     routine cleaned, no reals in conz3d

==========================================================

version  7_2_5    29-09-2015    VERS_7_2_5   commit_2015-09-30

version  7_2_5    29-09-2015    VERS_7_2_5   commit_2015-09-29

version  7_2_5    29-09-2015    VERS_7_2_5

========================================================== 29-09-2015 - 7_2_5

c ./fem3d/subnsh.f:
c 24.09.2015    ggu     call initialization for irv before reading STR file
c
c ./fem3d/shyfem.f:
c 29.09.2015    ccf	inverted set_spherical() and handle_projection()
c
c ./fem3d/newnudge.f:
c 25.09.2015    ggu     prepared for nudging velocities
c 29.09.2015    ggu     finished nudging velocities
c
c ./fem3d/suboutput.f:
c 24.09.2015    ggu     new file for double precision version
c
c ./fem3d/subver.f:
c 29.09.2015	ggu	version 7.2.5
c
c ./fem3d/suboutputd.f:
c 24.09.2015    ggu     routines re-written for double precision
c
c ./fem3d/subreg.f:
c 25.09.2015	ggu	new routines intp_reg_nodes(), intp_reg_elems()
c
c ./fem3d/subsys.f:
c 29.09.2015	ggu	new boundary file surfvel
c
c ./fem3d/newexpl.f:
c 25.09.2015	ggu	new call to set_nudging()
c
c ./fem3d/subfemintp.f:
! 25.09.2015	ggu	prepared to interpolate from reg onto elements
! 29.09.2015	ggu	in iff_interpolate() do not interpolate with flag

==========================================================

version  7_2_4    23-09-2015    VERS_7_2_4   commit_2015-09-29

version  7_2_4    23-09-2015    VERS_7_2_4   commit_2015-09-29

version  7_2_4    23-09-2015    VERS_7_2_4   commit_2015-09-28

version  7_2_4    23-09-2015    VERS_7_2_4   commit_2015-09-25

version  7_2_4    23-09-2015    VERS_7_2_4   commit_2015-09-24

version  7_2_4    23-09-2015    VERS_7_2_4   commit_2015-09-24

version  7_2_4    23-09-2015    VERS_7_2_4

========================================================== 23-09-2015 - 7_2_4

c ./fem3d/subnos.f:
c 22.09.2015	ggu	new routine nos_check_compatibility()
c
c ./fem3d/suboutput.f:
c 23.09.2015    ggu     new routine convert_time_d() for double
c
c ./fem3d/elabutil.f:
! 22.09.2015	ggu	new routine open_shy_file()
!
c ./fem3d/subver.f:
c 23.09.2015	ggu	version 7.2.4
c
c ./fem3d/subtime.f:
c 23.09.2015    ggu     time step is now working with dt as double
c
c ./fem3d/noselab1.f:
c 23.09.2015    ggu     handle more than one file (look for itstart)
c
c ./fem3d/nosutil.f:
c 23.09.2015    ggu     close files in nos_get_it_start() nos_get_it_end()

==========================================================

version  7_2_3    18-09-2015    VERS_7_2_3   commit_2015-09-23

version  7_2_3    18-09-2015    VERS_7_2_3   commit_2015-09-21

version  7_2_3    18-09-2015    VERS_7_2_3

========================================================== 18-09-2015 - 7_2_3

c ./fem3d/shyfem.f:
c 18.09.2015    ggu	new routine scalar, call to hydro()
c
c ./fem3d/subver.f:
c 18.09.2015	ggu	version 7.2.3
c
c ./fem3d/newchk.f:
c 17.09.2015    ggu     in mass_conserve aux variables are local
c
c ./fem3d/subqfxt.f:
c 18.09.2015	ccf	do not compute heat fluxes in dry nodes
c 18.09.2015	ccf	checks only for levdbg > 2
c
c ./fem3d/tideg.f:
c 18.09.2015    ggu     zeqv is now initialized even without use of tides (bug)
c
c ./fem3d/new3di.f:
c 17.09.2015    ggu	sp256w renamed to hydro_vertical
c 17.09.2015    ggu	sp259f renamed to hydro
c 18.09.2015    ggu	sp256 renamed to hydro_transports, file cleaned
c
c ./fem3d/mod_subset.f:
c 18.09.2015	ggu	code integrated
c
c ./fem3d/newexpl.f:
c 18.09.2015	ggu	use momentx/yv to store advective terms, not aux arrays
c
c ./fem3d/subdif.f:
c 18.09.2015    ggu     austau() not used anymore - eliminated
c
c ./fem3d/subcoo.f:
c 18.09.2015    ggu     bug fix in coo_init - do not set ip/jp for n==0

==========================================================

version  7_2_2    14-09-2015    VERS_7_2_2   commit_2015-09-18

version  7_2_2    14-09-2015    VERS_7_2_2

========================================================== 14-09-2015 - 7_2_2

c ./femplot/supsim.f:
c 14.09.2015    ggu	prepared for plotting velocities given in fem file
c
c ./femplot/supout.f:
c 14.09.2015  ggu     introduced bwind and bvel (for velocities)
c
c ./fem3d/subver.f:
c 14.09.2015	ggu	version 7.2.2
c
c ./fem3d/optintp.f:
c 14.09.2015	ggu	OI adapted to new modular structure
c
c ./fem3d/noselab1.f:
c 10.09.2015    ggu     std and rms for averaging implemented
c 11.09.2015    ggu     write in gis format
c
c ./fem3d/shyelab.f:
c 14.09.2015    ggu     support for ext files added
c
c ./fem3d/ouselab1.f:
c 11.09.2015    ggu     split feature added
c
c ./fem3d/subext.f:
c 14.09.2015	ggu	some more helper routines
c
c ./fem3d/ousutil.f:
c 11.09.2015    ggu     weight and hl are local, new velzeta2scal()
c
c ./fem3d/subsss.f:
c 14.09.2015	ggu	new routine i2s0()

==========================================================

version  7_2_1    31-07-2015    VERS_7_2_1   commit_2015-09-14

version  7_2_1    31-07-2015    VERS_7_2_1

========================================================== 31-07-2015 - 7_2_1

c ./fem3d/subver.f:
c 31.07.2015	ggu	version 7.2.1	holiday release

==========================================================

version  7_1_84    31-07-2015    VERS_7_1_84   commit_2015-07-31

version  7_1_84    31-07-2015    VERS_7_1_84   commit_2015-07-31

version  7_1_84    31-07-2015    VERS_7_1_84

========================================================== 31-07-2015 - 7_1_84

c ./fem3d/subver.f:
c 31.07.2015	ggu	version 7.1.84

==========================================================

version  7_1_83    30-07-2015    VERS_7_1_83   commit_2015-07-31

version  7_1_83    30-07-2015    VERS_7_1_83

========================================================== 30-07-2015 - 7_1_83

c ./fem3d/shyfem.f:
c 30.07.2015    ggu	routine renamed from ht to shyfem
c
c ./fem3d/subver.f:
c 30.07.2015	ggu	version 7.1.83
c
c ./fem3d/subcst.f:
c 30.07.2015    ggu     read str-file from command line
c
c ./fem3d/shypre.f:
c 30.07.2015    ggu     vp renamed to shypre
c
c ./fem3d/shyelab.f:
c 30.07.2015    ggu     shyelab started

==========================================================

version  7_1_82    24-07-2015    VERS_7_1_82   commit_2015-07-30

version  7_1_82    24-07-2015    VERS_7_1_82

========================================================== 24-07-2015 - 7_1_82

c ./fem3d/subver.f:
c 24.07.2015	ggu	version 7.1.82

==========================================================

version  7_1_81    20-07-2015    VERS_7_1_81   commit_2015-07-24

version  7_1_81    20-07-2015    VERS_7_1_81

========================================================== 20-07-2015 - 7_1_81

c ./fem3d/subver.f:
c 20.07.2015	ggu	version 7.1.81

==========================================================

version  7_1_80    17-07-2015    VERS_7_1_80   commit_2015-07-20

version  7_1_80    17-07-2015    VERS_7_1_80   commit_2015-07-20

version  7_1_80    17-07-2015    VERS_7_1_80

========================================================== 17-07-2015 - 7_1_80

c ./fem3d/subver.f:
c 17.07.2015	ggu	version 7.1.80

==========================================================

version  7_1_53    17-07-2015    VERS_7_1_53   commit_2015-07-17

version  7_1_53    17-07-2015    VERS_7_1_53

========================================================== 17-07-2015 - 7_1_53

c ./fem3d/subver.f:
c 17.07.2015	ggu	version 7.1.52
c 17.07.2015	ggu	version 7.1.53

==========================================================

version  7_1_52    17-07-2015    VERS_7_1_52   commit_2015-07-17

version  7_1_52    17-07-2015    VERS_7_1_52

========================================================== 17-07-2015 - 7_1_52

c ./fem3d/subver.f:
c 13.07.2015	ggu	version 7.1.52

==========================================================

version  7_1_51    13-07-2015    VERS_7_1_51   commit_2015-07-17

version  7_1_51    13-07-2015    VERS_7_1_51

========================================================== 13-07-2015 - 7_1_51

c ./fem3d/subver.f:
c 13.07.2015	ggu	version 7.1.51

==========================================================

version  7_1_50    10-07-2015    VERS_7_1_50   commit_2015-07-13

version  7_1_50    10-07-2015    VERS_7_1_50

========================================================== 10-07-2015 - 7_1_50

c ./fem3d_50/subbnd.f:
c 23.06.2015    ggu	setbc() deleted, nrz,nrq eliminated
c
c ./fem3d/subver.f:
c 10.07.2015	ggu	version 7.1.50	big release...
c
c ./fem3d/subbnd.f:
c 23.06.2015    ggu	setbc() deleted, nrz,nrq eliminated

==========================================================

version  7_1_12    05-06-2015    VERS_7_1_12   commit_2015-07-10

version  7_1_12    05-06-2015    VERS_7_1_12

========================================================== 05-06-2015 - 7_1_12

c ./fem3d_05/simsys_spk.f:
c 25.05.2015	ggu	some calls chenaged (pass array in)
c
c ./fem3d_05/subdep.f:
c 25.05.2015	ggu	some changes in depth computation
c
c ./fem3d_05/newini.f:
c 25.05.2015    ggu	file cleaned and prepared for module
c
c ./fem3d_05/subbas.f:
c 25.05.2015	ggu	module introduced
c
c ./fem3d_04/simsys_spk.f:
c 25.05.2015	ggu	some calls chenaged (pass array in)
c
c ./fem3d_04/subdep.f:
c 25.05.2015	ggu	some changes in depth computation
c
c ./fem3d_04/newini.f:
c 25.05.2015    ggu	file cleaned and prepared for module
c
c ./fem3d_04/subbas.f:
c 25.05.2015	ggu	module introduced
c
c ./fem3d_06/simsys_spk.f:
c 25.05.2015	ggu	some calls chenaged (pass array in)
c
c ./fem3d_06/subdep.f:
c 25.05.2015	ggu	some changes in depth computation
c
c ./fem3d_06/newini.f:
c 25.05.2015    ggu	file cleaned and prepared for module
c
c ./fem3d_06/subbas.f:
c 25.05.2015	ggu	module introduced
c
c ./femplot/supsim.f:
c 05.06.2015    ggu	some plotting routines adjourned (flag)
c
c ./femplot/supano.f:
c 05.06.2015  ggu     new keyword vart in legend for variable text
c
c ./fem3d/subclo.f:
! 28.05.2015    ggu     new routine clo_add_sep()
!
c ./fem3d/tmp/alloc1/3/new/subnos1.f:
! 30.05.2015	ggu	module introduced
!
c ./fem3d/simsys_spk.f:
c 25.05.2015	ggu	some calls changed (pass array in)
c
c ./fem3d/subver.f:
c 05.06.2015	ggu	version 7.1.12
c
c ./fem3d/subwrt.f:
c 05.06.2015	ggu	new routine to limit concentration between 0 and c0
c
c ./fem3d/femelab.f:
! 05.06.2015    ggu     iextract to extract nodal value
c
c ./fem3d/noselab.f:
c 05.06.2015    ggu     many more features added
c
c ./fem3d/subdep.f:
c 25.05.2015	ggu	some changes in depth computation
c
c ./fem3d/newini.f:
c 25.05.2015    ggu	file cleaned and prepared for module
c
c ./fem3d/subbas.f:
c 25.05.2015	ggu	module introduced
c
c ./fem3d_03/newini.f:
c 25.05.2015    ggu	file cleaned and prepared for module

==========================================================

version  7_1_11    21-05-2015    VERS_7_1_11   commit_2015-06-05

version  7_1_11    21-05-2015    VERS_7_1_11   commit_2015-05-25

version  7_1_11    21-05-2015    VERS_7_1_11

========================================================== 21-05-2015 - 7_1_11

c ./femplot/supano.f:
c 06.05.2015  ggu     prepared for logarithmic color bar
c
c ./femplot/col.f:
c 06.05.2015    ggu     logarithmic scale introduced (ilog, blog)
c
c ./fem3d/subetsa.f:
c 30.05.2015    ggu     new read from STR file, using module ets
c
c ./fem3d/sublnka.f:
c 20.05.2015    ggu     new call to mklenkii to set up lenkiiv
c
c ./fem3d/subnls.f:
c 12.05.2015	ggu	new char table
c
c ./fem3d/tmp/al1/lagrange_sedim.f:
c 06.05.2015    ccf	written from scratch
c
c ./fem3d/tmp/al1/lagrange_inout.f:
c 06.05.2015    ccf	write relative total depth and type to output
c 07.05.2015    ccf	assign settling velocity to particles
c
c ./fem3d/tmp/al1/lagrange_vertical.f:
c 06.05.2015    ccf     included settling velocity for lagrangian
c
c ./fem3d/tmp/al1/suboff.f:
c 06.05.2015    ccf     write offline to .off file
c			read offline from offlin file in section name
c
c ./fem3d/lagrange_init.f:
c 20.05.2015    ccf	give type to released particles
c
c ./fem3d/lagrange_sedim.f:
c 06.05.2015    ccf	written from scratch
c
c ./fem3d/submeteo2.f:
c 12.05.2015    ggu	introduced ia_icefree for icefree elements
c
c ./fem3d/subver.f:
c 21.05.2015	ggu	version 7.1.11
c
c ./fem3d/newcon.f:
c 20.05.2015    ggu     accumulate over nodes (for parallel version)
c
c ./fem3d/subn35.f:
c 12.05.2015    ggu     rewritten with modules and allocatable
c
c ./fem3d/subinterpol.f:
c 06.05.2015	ggu	set number of max iterations (imax)
c
c ./fem3d/subflxa.f:
c 20.05.2015    ggu     modules introduced
c
c ./fem3d/links.f:
c 30.05.2015    ggu	new subroutine mklenkii to compute lenkiiv
c
c ./fem3d/subexta.f:
c 20.05.2015    ggu     modules introduced
c
c ./fem3d/subsys.f:
c 06.05.2015	ccf	new parameters itmoff and offlin
c
c ./fem3d/new3di.f:
c 06.05.2015    ggu     cleaning up of sp256f
c 20.05.2015    ggu&erp sp256v parallelized
c
c ./fem3d/subwrt.f:
c 20.05.2015	ggu	rinside computed only once, bug fix for conz==0
c
c ./fem3d/lagrange_inout.f:
c 06.05.2015    ccf	write relative total depth and type to output
c 07.05.2015    ccf	assign settling velocity to particles
c
c ./fem3d/femelab.f:
! 20.05.2015    ggu     use bhuman to convert to human readable time
c
c ./fem3d/etsutil.f:
c 30.05.2015    ggu     new code for reading header 1 and 2 indipendently
c
c ./fem3d/subxi.f:
c 16.05.2015	ccf	add some more check in xit_start_end for small numbers
c
c ./fem3d/lagrange_vertical.f:
c 06.05.2015    ccf     included settling velocity for lagrangian
c 08.05.2015    ggu&ccf bug fix in track_xi_next_element
c 14.05.2015    ccf     bug fix in track_xi
c
c ./fem3d/noselab.f:
c 06.05.2015    ggu     noselab started
c
c ./fem3d/newstab.f:
c 20.05.2015    ggu	always compute stability, call to conzstab changed
c
c ./fem3d/suboff.f:
c 06.05.2015    ccf     write offline to .off file
c 06.05.2015    ccf     read offline from offlin file in section name
c
c ./fem3d/subsss.f:
c 06.05.2015	ggu	new routine logvals() for logarithmic values

==========================================================

version  7_1_10    05-05-2015    VERS_7_1_10   commit_2015-05-21

version  7_1_10    05-05-2015    VERS_7_1_10

========================================================== 05-05-2015 - 7_1_10

c ./fem3d/sublnka.f:
c 04.05.2015    ggu     remove equivalence - use winkv as local array
c
c ./fem3d/submeteo2.f:
c 04.05.2015    ggu	bug in ice eliminated
c
c ./fem3d/subver.f:
c 05.05.2015	ggu	version 7.1.10

==========================================================

version  7_1_9    30-04-2015    VERS_7_1_9   commit_2015-05-05

version  7_1_9    30-04-2015    VERS_7_1_9   commit_2015-05-05

version  7_1_9    30-04-2015    VERS_7_1_9

========================================================== 30-04-2015 - 7_1_9

c ./fem3d/submeteo2.f:
c 30.04.2015    ggu	ice integrated
c
c ./fem3d/subver.f:
c 30.04.2015	ggu	version 7.1.9	Harald's birthday '
c
c ./fem3d/submet.f:
c 30.04.2015    ggu     ice cover implemented
c
c ./fem3d/subn35.f:
c 28.04.2015    ggu     czdef is default for all areas not given
c
c ./fem3d/ousextr_cat.f:
c 29.04.2015    ggu     mode 1 implemented
c
c ./fem3d/ousutil.f:
c 29.04.2015    ggu     new helper routines for start/end time in file
c
c ./fem3d/subuti.f:
c 29.04.2015    ggu     energy now in Joule
c
c ./fem3d/subapn.f:
c 29.04.2015	ggu	generic changes - now works as anticipated

==========================================================

version  7_1_8    23-04-2015    VERS_7_1_8   commit_2015-04-30

version  7_1_8    23-04-2015    VERS_7_1_8

========================================================== 23-04-2015 - 7_1_8

c ./femplot/suplag.f:
c 23.04.2015    ggu     plotting for 3d particles
c
c ./fem3d/lgrinf.f:
c 23.04.2015    ggu     for new version 5
c
c ./fem3d/lagrange_main.f:
c 23.04.2015    ggu     internal coordinates implemented (blgrxi)
c
c ./fem3d/subver.f:
c 23.04.2015	ggu	version 7.1.8	St. George's release '
c
c ./fem3d/subnev.f:
c 19.04.2015	ggu	new routines for internal coordinates (distance)
c 22.04.2015	ggu	bug fix in xi2xy - x/y were exchanged
c
c ./fem3d/subxi.f:
c 23.04.2015	ggu	compute s value for particle path
c
c ./fem3d/lagrange_vertical.f:
c 23.04.2015    ggu     internal coodinates finished

==========================================================

version  7_1_7    01-04-2015    VERS_7_1_7   commit_2015-04-23

version  7_1_7    01-04-2015    VERS_7_1_7

========================================================== 01-04-2015 - 7_1_7

c ./fem3d/tmp/javier/subwrt.f:
c 11.03.2015	ggu	introduced bstop, if early stop, write to file
c
c ./fem3d/subdts.f:
c 31.03.2015    ggu     bug fix - month was 71/2, now 61/2
c
c ./fem3d/subver.f:
c 01.04.2015	ggu	version 7.1.7	first of aprile version
c
c ./fem3d/subnev.f:
c 31.03.2015	ggu	new routines for internal coordinates
c
c ./fem3d/subwrt.f:
c 31.03.2015	ggu	compute res time for different areas
c
c ./fem3d/subbas.f:
c 31.03.2015	ggu	set iarnv on read

==========================================================

version  7_1_6    26-02-2015    VERS_7_1_6   commit_2015-04-01

version  7_1_6    26-02-2015    VERS_7_1_6

========================================================== 26-02-2015 - 7_1_6

c ./fem3d/subver.f:
c 26.02.2015	ggu	version 7.1.6

==========================================================

version  7_1_5    26-02-2015    VERS_7_1_5   commit_2015-02-26

version  7_1_5    26-02-2015    VERS_7_1_5

========================================================== 26-02-2015 - 7_1_5

c ./femplot/supbas.f:
c 10.02.2015  ggu     also plot other points, also regular points
c
c ./femplot/supout.f:
c 10.02.2015  ggu     use different file units (more than one can be opened)
c
c ./fem3d/subtsfile.f:
c 10.02.2015    ggu     length of line set to 2048
c
c ./fem3d/subclo.f:
! 26.01.2015    ggu     make argument to clo_parse_options() optional
! 26.01.2015    ggu     new routine clo_check_files()
! 08.02.2015    ggu     bug fix in clo_get_option, new routine clo_info
!
c ./fem3d/subnls.f:
c 05.02.2015	ggu	program completely rewritten (modules introduced)
c 08.02.2015	ggu	accept also '!' and '#' for end comment on line
c
c ./fem3d/subbnds.f:
c 05.02.2015    ggu     check for number of variables read
c 10.02.2015    ggu     new routine bnds_read_new()
c
c ./fem3d/subssm.f:
c 10.02.2015    ggu     some double precision routines introduced
c
c ./fem3d/kepsd.f:
c 10.02.2015	ggu	in gotm call to do_gotm_turb() with ddt and not dt
c
c ./fem3d/subver.f:
c 26.02.2015	ggu	version 7.1.5
c
c ./fem3d/subpar3.f:
c 13.02.2015    ggu     limit of string raised from 6 to 10
c
c ./fem3d/subnosa.f:
c 10.02.2015    ggu     some new routines for writing...
c
c ./fem3d/optintp.f:
c 07.02.2015	ggu	OI finished
c
c ./fem3d/newconz.f:
c 10.02.2015    ggu     call to bnds_read_new() introduced
c
c ./fem3d/newbcl.f:
c 10.02.2015    ggu     call to bnds_read_new() introduced
c
c ./fem3d/feminf.f:
! 10.02.2015    ggu     option for not complaining about changed time step
c
c ./fem3d/subn11.f:
c 10.02.2015    ggu     new call to iff_read_and_interpolate()
c
c ./fem3d/arc/subnls_new.f:
c 05.02.2015	ggu	program completely rewritten (modules introduced)
c
c ./fem3d/subscn.f:
c 06.02.2015	ggu	new routines istos,iston,is_digit,is_letter
c
c ./fem3d/subfemintp.f:
! 05.02.2015	ggu	iff_read_and_interpolate() introduced for parallel bug
!
c ./fem3d/subapn.f:
c 10.02.2015	ggu	debugged, bcompat gives compatibility with old versions

==========================================================

version  7_1_4    23-01-2015    VERS_7_1_4   commit_2015-02-26

version  7_1_4    23-01-2015    VERS_7_1_4

========================================================== 23-01-2015 - 7_1_4

c ./fem3d/subver.f:
c 23.01.2015	ggu	version 7.1.4
c
c ./fem3d/subwaves.f:
! 21.01.2015	ggu	computing fetch for geographical coordinates (bug fix)
!
c ./fem3d/subnev.f:
c 21.01.2015	ggu	new routine compute_cartesian_coords()
c
c ./fem3d/subproj.f:
c 21.01.2015    ggu     code to handle projection in both directions

==========================================================

version  7_1_3    19-01-2015    VERS_7_1_3   commit_2015-01-23

version  7_1_3    19-01-2015    VERS_7_1_3

========================================================== 19-01-2015 - 7_1_3

c ./fem3d/subver.f:
c 19.01.2015	ggu	version 7.1.3	huge commit (include for common)

==========================================================

version  7_1_2    19-01-2015    VERS_7_1_2   commit_2015-01-19

version  7_1_2    19-01-2015    VERS_7_1_2

========================================================== 19-01-2015 - 7_1_2

c ./fem3d/subver.f:
c 19.01.2015	ggu	version 7.1.2

==========================================================

version  7_1_1    15-01-2015    VERS_7_1_1   commit_2015-01-19

version  7_1_1    15-01-2015    VERS_7_1_1   commit_2015-01-19

version  7_1_1    15-01-2015    VERS_7_1_1   commit_2015-01-19

version  7_1_1    15-01-2015    VERS_7_1_1   commit_2015-01-16

version  7_1_1    15-01-2015    VERS_7_1_1   commit_2015-01-16

version  7_1_1    15-01-2015    VERS_7_1_1

========================================================== 15-01-2015 - 7_1_1

c ./fem3d/subclo.f:
! 14.01.2015    ggu     added new routines clo_add_info/extra
!
c ./fem3d/subver.f:
c 15.01.2015	ggu	version 7.1.1
c
c ./fem3d/feminf.f:
! 14.01.2015    ggu     finished and cleaned
c
c ./fem3d/tideg.f:
c 14.01.2015    ccf     small bug fix rounding date and time
c
c ./fem3d/femelab.f:
! 14.01.2015    ggu     adapted from feminf
c
c ./fem3d/subfemfile.f:
c 14.01.2015	ggu	new routine fem_file_string2time()
c
c ./fem3d/subapn.f:
c 14.01.2015	ggu	reorganized and cleaned

==========================================================

version  7_1_0    12-01-2015    VERS_7_1_0   commit_2015-01-15

version  7_1_0    12-01-2015    VERS_7_1_0

========================================================== 12-01-2015 - 7_1_0

c ./tmp/shyfem-1e5396afab_2015-01-12_stable/fem3d/subfemfile.f:
c 09.01.2015	ggu	new routine fem_file_get_format_description()
c
c ./fem3d/subver.f:
c 12.01.2015	ggu	version 7.1.0	Wolfgangs release
c
c ./fem3d/subfemfile.f:
c 09.01.2015	ggu	new routine fem_file_get_format_description()

==========================================================

version  7_0_12    09-01-2015    VERS_7_0_12   commit_2015-01-12

version  7_0_12    09-01-2015    VERS_7_0_12

========================================================== 09-01-2015 - 7_0_12

c ./fem3d/subnls.f:
c 08.01.2015	ggu	new version for nrdvec*()
c
c ./fem3d/subver.f:
c 09.01.2015	ggu	version 7.0.12
c
c ./fem3d/subtime.f:
c 07.01.2015    ggu     fractional time step without rounding (itsplt=3)
c
c ./fem3d/subgrd.f:
c 08.01.2015    ggu     common blocks in include file
c
c ./fem3d/subbas.f:
c 04.01.2015	ggu	new routine sp13_get_par()
c
c ./fem3d/subfemintp.f:
! 07.01.2015	ggu	bug fix in iff_populate_records() -> handle holes
! 08.01.2015	ggu	bug fix for parallel: make variables local

==========================================================

version  7_0_11    23-12-2014    VERS_7_0_11   commit_2015-01-09

version  7_0_11    23-12-2014    VERS_7_0_11

========================================================== 23-12-2014 - 7_0_11

c ./femplot/suplin.f:
c 22.12.2014    ggu     new routine integrate_flux()
c
c ./fem3d/subver.f:
c 23.12.2014	ggu	version 7.0.11	pre Christmas eve release
c
c ./fem3d/subtime.f:
c 23.12.2014    ggu     fractional time step introduced
c
c ./fem3d/ousvdiff.f:
c 20.12.2014	ggu	bug fix: nlv was not set, new calling sequence

==========================================================

version  7_0_10    19-12-2014    VERS_7_0_10   commit_2014-12-23

version  7_0_10    19-12-2014    VERS_7_0_10

========================================================== 19-12-2014 - 7_0_10

c ./fem3d/subver.f:
c 19.12.2014	ggu	version 7.0.10	pre Christmas release
c
c ./fem3d/subtime.f:
c 19.12.2014    ggu     accept date also as string

==========================================================

version  7_0_9    12-12-2014    VERS_7_0_9   commit_2014-12-19

version  7_0_9    12-12-2014    VERS_7_0_9   commit_2014-12-18

version  7_0_9    12-12-2014    VERS_7_0_9

========================================================== 12-12-2014 - 7_0_9

c ./fem3d/subrst.f:
c 11.12.2014    ccf     bug fix for atime
c
c
c ./fem3d/subver.f:
c 12.12.2014	ggu	version 7.0.9	pre St Lucia release

==========================================================

version  7_0_8    05-12-2014    VERS_7_0_8   commit_2014-12-12

version  7_0_8    05-12-2014    VERS_7_0_8

========================================================== 05-12-2014 - 7_0_8

c ./fem3d/subclo.f:
! 27.11.2014    ggu     is now fully functional
!
c ./fem3d/subnsh.f:
c 01.12.2014    ccf     handle new section waves for wave module
c
c ./fem3d/subver.f:
c 05.12.2014	ggu	version 7.0.8	pre Santa Claus release
c
c ./fem3d/subsys.f:
c 01.12.2014	ccf	wave parameters moved to subwave.f
c
c ./fem3d/ht.f:
c 05.12.2014    ccf	new interface for waves

==========================================================

version  7_0_7    26-11-2014    VERS_7_0_7   commit_2014-12-05

version  7_0_7    26-11-2014    VERS_7_0_7

========================================================== 26-11-2014 - 7_0_7

c ./fem3d/subnsh.f:
c 10.11.2014    ggu     shyfem time management routines to new file subtime.f
c
c ./fem3d/subdts.f:
c 12.11.2014    ggu     new routines for unformatting and timespan
c
c ./fem3d/suboutput.f:
c 10.11.2014    ggu     time management routines transfered to this file
c
c ./fem3d/subver.f:
c 26.11.2014	ggu	version 7.0.7	Peter Epplers Geburtstags release
c
c ./fem3d/subtime.f:
c 10.11.2014    ggu     time management routines transfered to this file
c
c ./fem3d/subcst.f:
c 10.11.2014    ggu     time and date routines transfered to subtime.f

==========================================================

version  7_0_6    07-11-2014    VERS_7_0_6   commit_2014-11-25

version  7_0_6    07-11-2014    VERS_7_0_6

========================================================== 07-11-2014 - 7_0_6

c ./fem3d/subver.f:
c 07.11.2014	ggu	version 7.0.6
c
c ./fem3d/subn11.f:
c 07.11.2014    ggu     bug fix for distance computation in z_tilt, c_tilt

==========================================================

version  7_0_5    05-11-2014    VERS_7_0_5   commit_2014-11-07

version  7_0_5    05-11-2014    VERS_7_0_5

========================================================== 05-11-2014 - 7_0_5

c ./tmp/shyfem-f307c41547_2014-11-04_stable/fem3d/subwaves.f:
! 04.11.2014	ccf	rewritten
!
c ./tmp/shyfem-f307c41547_2014-11-04_stable/fem3d/subbnd.f:
c 03.11.2014    ggu	nbdim deleted
c
c ./tmp/shyfem-f307c41547_2014-11-04_stable/fem3d/subnev.f:
c 30.10.2014	ggu	new routine compute_distance()
c
c ./tmp/shyfem-f307c41547_2014-11-04_stable/fem3d/subn11.f:
c 30.10.2014    ggu     in c_tilt() compute distance also for lat/lon
c 31.10.2014    ccf     new call to init_z0 instead than init_z0b
c
c ./tmp/shyfem-f307c41547_2014-11-04_stable/fem3d/newini.f:
c 31.10.2014    ccf	initi_z0 for zos and zob
c
c ./fem3d/subver.f:
c 05.11.2014	ggu	version 7.0.5
c
c ./fem3d/subwaves.f:
! 04.11.2014	ccf	rewritten
!
c ./fem3d/subbnd.f:
c 03.11.2014    ggu	nbdim deleted
c
c ./fem3d/subnev.f:
c 30.10.2014	ggu	new routine compute_distance()
c
c ./fem3d/subn11.f:
c 30.10.2014    ggu     in c_tilt() compute distance also for lat/lon
c 31.10.2014    ccf     new call to init_z0 instead than init_z0b
c
c ./fem3d/newini.f:
c 31.10.2014    ccf	initi_z0 for zos and zob

==========================================================

version  7_0_4    30-10-2014    VERS_7_0_4   commit_2014-11-04

version  7_0_4    30-10-2014    VERS_7_0_4

========================================================== 30-10-2014 - 7_0_4

c ./tmp/shyfem-8c666943c1_2014-10-30_stable/fem3d/subnos.f:
c 29.10.2014	ggu	new routine nos_is_nos_file()
c
c ./tmp/shyfem-8c666943c1_2014-10-30_stable/fem3d/subnsh.f:
c 29.10.2014    ggu     do_() routines transfered from newpri.f
c
c ./tmp/shyfem-8c666943c1_2014-10-30_stable/fem3d/subboxa.f:
c 29.10.2014    ggu     new code and 3d version
c
c ./tmp/shyfem-8c666943c1_2014-10-30_stable/fem3d/subfemfile.f:
c 29.10.2014	ggu	new routine fem_file_is_fem_file()
c
c ./tmp/shyfem-8c666943c1_2014-10-30_stable/fem3d/subous.f:
c 29.10.2014	ggu	new routine ous_is_ous_file()
c
c ./tmp/shyfem-8c666943c1_2014-10-30_stable/fem3d/subbas.f:
c 23.10.2014	ggu	introduced ftype and nvers = 4
c
c ./fem3d/subnos.f:
c 29.10.2014	ggu	new routine nos_is_nos_file()
c
c ./fem3d/subnsh.f:
c 29.10.2014    ggu     do_() routines transfered from newpri.f
c
c ./fem3d/subver.f:
c 30.10.2014	ggu	version 7.0.4
c
c ./fem3d/subboxa.f:
c 29.10.2014    ggu     new code and 3d version
c
c ./fem3d/subfemfile.f:
c 29.10.2014	ggu	new routine fem_file_is_fem_file()
c
c ./fem3d/subous.f:
c 29.10.2014	ggu	new routine ous_is_ous_file()
c
c ./fem3d/subbas.f:
c 23.10.2014	ggu	introduced ftype and nvers = 4

==========================================================

version  7_0_3    21-10-2014    VERS_7_0_3   commit_2014-10-30

version  7_0_3    21-10-2014    VERS_7_0_3

========================================================== 21-10-2014 - 7_0_3

c ./tmp/shyfem-d10f7da76c_2014-10-21_stable/femplot/plotsim.f:
c 20.10.2014	ggu	handle absolute and plotting time
c
c ./tmp/shyfem-d10f7da76c_2014-10-21_stable/femplot/supsim.f:
c 20.10.2014    ggu	new time management
c
c ./tmp/shyfem-d10f7da76c_2014-10-21_stable/femplot/suptim.f:
c 20.10.2014  ggu     completely restructured, old routines deleted
c
c ./tmp/shyfem-d10f7da76c_2014-10-21_stable/femplot/supout.f:
c 20.10.2014  ggu     deleted is2d() and out reading routines
c
c ./tmp/shyfem-d10f7da76c_2014-10-21_stable/femplot/supano.f:
c 16.10.2014  ggu     annotes doesnt need it anymore
c
c ./tmp/shyfem-d10f7da76c_2014-10-21_stable/fem3d/subtsfile.f:
c 20.10.2014    ggu     integrating datetime into time series
c
c ./tmp/shyfem-d10f7da76c_2014-10-21_stable/fem3d/aquabc_fem_interface.f:
c 21.10.2014    ggu     converted to new boundary treatment
c
c ./tmp/shyfem-d10f7da76c_2014-10-21_stable/fem3d/subbfm.f:
c 21.10.2014    ggu	converted to new boundary treatment
c
c ./tmp/shyfem-d10f7da76c_2014-10-21_stable/fem3d/newcon.f:
c 20.10.2014    ggu     accept ids from calling routines
c
c ./tmp/shyfem-d10f7da76c_2014-10-21_stable/fem3d/newconz.f:
c 20.10.2014    ggu     pass ids to scal_adv routines
c
c ./tmp/shyfem-d10f7da76c_2014-10-21_stable/fem3d/subcst.f:
c 20.10.2014    ggu     new routine ckdate()
c
c ./tmp/shyfem-d10f7da76c_2014-10-21_stable/fem3d/newbcl.f:
c 20.10.2014    ggu     pass ids to scal_adv()
c
c ./tmp/shyfem-d10f7da76c_2014-10-21_stable/fem3d/bio3d.f:
c 21.10.2014    ggu     converted to new boundary treatment
c
c ./tmp/shyfem-d10f7da76c_2014-10-21_stable/fem3d/sedi3d.f:
c 21.10.2014    ggu     converted to new boundary treatment
c
c ./tmp/shyfem-d10f7da76c_2014-10-21_stable/fem3d/atoxi3d.f:
c 21.10.2014    ggu     converted to new boundary treatment
c
c ./tmp/shyfem-d10f7da76c_2014-10-21_stable/fem3d/subsys.f:
c 20.10.2014	ggu	new default for date (-1)
c
c ./tmp/shyfem-d10f7da76c_2014-10-21_stable/fem3d/subfemfile.f:
c 20.10.2014	ggu	second version (date record is just after first record)
c
c ./tmp/shyfem-d10f7da76c_2014-10-21_stable/fem3d/subfemintp.f:
! 20.10.2014	ggu	deal with datetime in fem/ts files
!
c ./femplot/plotsim.f:
c 20.10.2014	ggu	handle absolute and plotting time
c
c ./femplot/supsim.f:
c 20.10.2014    ggu	new time management
c
c ./femplot/suptim.f:
c 20.10.2014  ggu     completely restructured, old routines deleted
c
c ./femplot/supout.f:
c 20.10.2014  ggu     deleted is2d() and out reading routines
c
c ./femplot/supano.f:
c 16.10.2014  ggu     annotes doesnt need it anymore
c
c ./fem3d/subtsfile.f:
c 20.10.2014    ggu     integrating datetime into time series
c
c ./fem3d/aquabc_fem_interface.f:
c 21.10.2014    ggu     converted to new boundary treatment
c
c ./fem3d/subver.f:
c 21.10.2014	ggu	version 7.0.3
c
c ./fem3d/subbfm.f:
c 21.10.2014    ggu	converted to new boundary treatment
c
c ./fem3d/newcon.f:
c 20.10.2014    ggu     accept ids from calling routines
c
c ./fem3d/newconz.f:
c 20.10.2014    ggu     pass ids to scal_adv routines
c
c ./fem3d/subcst.f:
c 20.10.2014    ggu     new routine ckdate()
c
c ./fem3d/newbcl.f:
c 20.10.2014    ggu     pass ids to scal_adv()
c
c ./fem3d/bio3d.f:
c 21.10.2014    ggu     converted to new boundary treatment
c
c ./fem3d/sedi3d.f:
c 21.10.2014    ggu     converted to new boundary treatment
c
c ./fem3d/atoxi3d.f:
c 21.10.2014    ggu     converted to new boundary treatment
c
c ./fem3d/subsys.f:
c 20.10.2014	ggu	new default for date (-1)
c
c ./fem3d/subfemfile.f:
c 20.10.2014	ggu	second version (date record is just after first record)
c
c ./fem3d/subfemintp.f:
! 20.10.2014	ggu	deal with datetime in fem/ts files

==========================================================

version  7_0_2    13-10-2014    VERS_7_0_2   commit_2014-10-21

version  7_0_2    13-10-2014    VERS_7_0_2

========================================================== 13-10-2014 - 7_0_2

c ./tmp/shyfem-28da59bc8a_2014-10-13_stable/fem3d/subdts.f:
c 13.10.2014    ggu     absolute time routines inserted
c 13.10.2014    ggu     one day off error fixed ($ONEDAYOFF)
c
c ./tmp/shyfem-28da59bc8a_2014-10-13_stable/fem3d/wininf.f:
c 29.09.2014	ggu	uses allocatable ayyars
c
c ./fem3d/subdts.f:
c 13.10.2014    ggu     absolute time routines inserted
c 13.10.2014    ggu     one day off error fixed ($ONEDAYOFF)
c
c ./fem3d/subver.f:
c 13.10.2014	ggu	version 7.0.2
c
c ./fem3d/wininf.f:
c 29.09.2014	ggu	uses allocatable ayyars

==========================================================

version  7_0_1    18-07-2014    VERS_7_0_1   commit_2014-10-13

version  7_0_1    18-07-2014    VERS_7_0_1   commit_2014-10-13

version  7_0_1    18-07-2014    VERS_7_0_1

========================================================== 18-07-2014 - 7_0_1

c ./fem3d/subtsuvfile.f:
c 10.07.2014    ggu     only new file format allowed
c
c ./fem3d/subbnds.f:
c 10.07.2014    ggu     only new file format allowed
c
c ./fem3d/subver.f:
c 18.07.2014	ggu	version 7.0.1   last day before holidays
c
c ./fem3d/submet.f:
c 10.07.2014    ggu     only new file format allowed
c
c ./fem3d/newcon.f:
c 10.07.2014    ggu     only new file format allowed
c
c ./fem3d/newconz.f:
c 10.07.2014    ggu     only new file format allowed
c
c ./fem3d/newbcl.f:
c 10.07.2014    ggu     only new file format allowed
c
c ./fem3d/subn11.f:
c 10.07.2014    ggu     only new file format allowed

==========================================================

version  7_0_0    07-07-2014    VERS_7_0_0   commit_2014-07-18

version  7_0_0    07-07-2014    VERS_7_0_0

========================================================== 07-07-2014 - 7_0_0

c ./fem3d/subver.f:
c 07.07.2014	ggu	version 7.0.0   first of 7 series

==========================================================

version  6_1_79    07-07-2014    VERS_6_1_79

========================================================== 07-07-2014 - 6_1_79

c ./fem3d/subtsuvfile.f:
c 02.07.2014    ggu     new framework finished
c
c ./fem3d/subver.f:
c 07.07.2014	ggu	version 6.1.79  last of 6 series
c
c ./fem3d/subreg.f:
c 07.07.2014	ggu	new routine intp_reg()
c
c ./fem3d/subfemfile.f:
c 07.07.2014	ggu	first version consolidated
c
c ./fem3d/subfemintp.f:
! 07.07.2014	ggu	first version finished

==========================================================

version  6_1_78    27-06-2014    VERS_6_1_78   commit_2014-07-07

version  6_1_78    27-06-2014    VERS_6_1_78   commit_2014-07-07

version  6_1_78    27-06-2014    VERS_6_1_78

========================================================== 27-06-2014 - 6_1_78

c ./fem3d/subbnds.f:
c 25.06.2014    ggu     new routines bnds_init_new() and bnds_trans_new()
c
c ./fem3d/subver.f:
c 27.06.2014	ggu	version 6.1.78  Maria Huber release
c
c ./fem3d/sigmautil.f:
c 25.06.2014	ggu	error stop if computed layer thickness is <= 0
c
c ./fem3d/subbnd.f:
c 25.06.2014    ggu	new routine exists_bnd_name()
c
c ./fem3d/ht.f:
c 25.06.2014    ggu	new arrays hkv_min, hkv_max
c
c ./fem3d/subdep.f:
c 25.06.2014	ggu	computa also hkv_min and hkv_max
c
c ./fem3d/subfemintp.f:
! 25.06.2014	ggu	various bug fixes

==========================================================

version  6_1_77    18-06-2014    VERS_6_1_77   commit_2014-06-27

version  6_1_77    18-06-2014    VERS_6_1_77

========================================================== 18-06-2014 - 6_1_77

c ./tmp/shyfem-4168f3c3c5_2014-06-18_stable/fem3d/subbnd.f:
c 16.06.2014    ggu	new include file bnd.h (with nbndim)
c
c ./tmp/shyfem-4168f3c3c5_2014-06-18_stable/fem3d/subnsa.f:
c 06.06.2014	ggu	deleted sp158k() and sp158kk()
c
c ./tmp/shyfem-4168f3c3c5_2014-06-18_stable/fem3d/subfemfile.f:
c 16.06.2014	ggu	time is now double precision
c
c ./tmp/shyfem-4168f3c3c5_2014-06-18_stable/fem3d/subfemintp.f:
! 16.06.2014	ggu	tiem is noew double
!
c ./fem3d/subver.f:
c 18.06.2014	ggu	version 6.1.77  Clara's maturita' release
c
c ./fem3d/subbnd.f:
c 16.06.2014    ggu	new include file bnd.h (with nbndim)
c
c ./fem3d/subnsa.f:
c 06.06.2014	ggu	deleted sp158k() and sp158kk()
c
c ./fem3d/subfemfile.f:
c 16.06.2014	ggu	time is now double precision
c
c ./fem3d/subfemintp.f:
! 16.06.2014	ggu	tiem is noew double

==========================================================

version  6_1_76    30-05-2014    VERS_6_1_76   commit_2014-06-18

version  6_1_76    30-05-2014    VERS_6_1_76

========================================================== 30-05-2014 - 6_1_76

c ./femplot/supsim.f:
c 30.05.2014    ggu	flag no data points and do not plot
c
c ./femplot/supbas.f:
c 30.05.2014  ggu     new metpnt for meteo points, imicro computed
c
c ./fem3d/tmp/femfile/3/submeteo2.f:
c 20.05.2014    ggu	new routines for new file format
c
c ./fem3d/tmp/femfile/3/subintp.f:
c 18.05.2014	ggu	new routines d_intp_neville(), rd_intp_neville()
c
c ./fem3d/submeteo2.f:
c 20.05.2014    ggu	new routines for new file format
c
c ./fem3d/subver.f:
c 30.05.2014	ggu	version 6.1.76  Clara's birthday release '
c
c ./fem3d/submet.f:
c 30.05.2014    ggu     new imreg == 3
c
c ./fem3d/subintp.f:
c 18.05.2014	ggu	new routines d_intp_neville(), rd_intp_neville()
c
c ./fem3d/subreg.f:
c 30.05.2014	ggu	in av2amk() do not interpolate for flag values
c
c ./fem3d/subsys.f:
c 30.05.2014	ggu	new default for dragco, new metpnt
c
c ./fem3d/subfemfile.f:
c 30.05.2014	ggu	restructured
c
c ./fem3d/subsss.f:
c 30.05.2014	ggu	new routine rnextsub()

==========================================================

version  6_1_75    15-05-2014    VERS_6_1_75   commit_2014-05-30

version  6_1_75    15-05-2014    VERS_6_1_75

========================================================== 15-05-2014 - 6_1_75

c ./fem3d/subver.f:
c 15.05.2014	ggu	version 6.1.75  Frau Flierl's birthday release '
c
c ./fem3d/newcon.f:
c 15.05.2014    ggu     write min/max error only for levdbg >= 3
c
c ./fem3d/bio3d.f:
c 08.05.2014    ggu     bug in call to inicfil for es -> must be inic2fil
c
c ./fem3d/newchk.f:
c 15.05.2014    ggu     write mass error only for levdbg >= 3
c
c ./fem3d/subrgf.f:
c 15.05.2014    ggu&pzy bug fix: compare reals in rgf_check_header()

==========================================================

version  6_1_74    05-05-2014    VERS_6_1_74   commit_2014-05-15

version  6_1_74    05-05-2014    VERS_6_1_74   commit_2014-05-08

version  6_1_74    05-05-2014    VERS_6_1_74

========================================================== 05-05-2014 - 6_1_74

c ./fem3d/lagrange_main.f:
c 28.03.2014    ggu     code cleaned - connectivity
c 10.04.2014    ggu     new code for lagr_count
c
c ./fem3d/lagrange_cont.f:
c 28.03.2014    ggu	new routine lagr_continuous_release_pps_ppv()
c
c ./fem3d/subver.f:
c 05.05.2014	ggu	version 6.1.74
c
c ./fem3d/lagrange_decay.f:
c 28.03.2014    ggu	new version of decay (for all particles)
c
c ./fem3d/subbnd.f:
c 28.03.2014    ggu	new parameter lgrpps
c
c ./fem3d/subsys.f:
c 28.03.2014	ggu	some new params for lagrangian
c
c ./fem3d/new3di.f:
c 10.04.2014    ggu     cleaning up of a lot of stuff
c
c ./fem3d/newexpl.f:
c 10.04.2014	ggu	use rlin and rdistv to determin advective contribution
c
c ./fem3d/lagrange_inout.f:
c 28.03.2014    ggu	bug fix for inesrt with ie=0, area in concentrations
c
c ./fem3d/wininf.f:
c 16.04.2014	ggu	reads now also new meteo format
c
c ./fem3d/lagrange_util.f:
c 28.03.2014    ggu     compute total length of open boundary
c
c ./fem3d/subfemfile.f:
c 24.04.2014	ggu	use nvar>0 as indication of good read
c
c ./fem3d/newstab.f:
c 08.04.2014    ggu	use rlin to determine advective stability

==========================================================

version  6_1_73    27-03-2014    VERS_6_1_73   commit_2014-05-05

version  6_1_73    27-03-2014    VERS_6_1_73   commit_2014-03-31

version  6_1_73    27-03-2014    VERS_6_1_73

========================================================== 27-03-2014 - 6_1_73

c ./fem3d/subver.f:
c 27.03.2014	ggu	version 6.1.73
c
c ./fem3d/subgotm.f:
c 25.03.2014    ggu     new offline
c
c ./fem3d/newbcl.f:
c 25.03.2014    ggu     new offline
c
c ./fem3d/new3di.f:
c 25.03.2014    ggu     new offline
c
c ./fem3d/ht.f:
c 25.03.2014    ggu	new offline
c
c ./fem3d/subcus.f:
c 25.03.2014	ggu	new routine conz_decay_curonian()
c
c ./fem3d/suboff.f:
c 25.03.2014    ggu     new offline (for T/S)

==========================================================

version  6_1_72    07-03-2014    VERS_6_1_72   commit_2014-03-27

version  6_1_72    07-03-2014    VERS_6_1_72

========================================================== 07-03-2014 - 6_1_72

 * ./grid/gridma2.c:
 * 21-Feb-2014: new routine MakeGravityPoint() and InPoly()		*
 * 18-Feb-2014: new routines DelNodeLine(), InsertNodeLine()		*
 * ./grid/gridut.c:
 * 18-Feb-2014: new routine Dist2Node()					*
 * ./grid/xevents.c:
 * 05-Mar-2014: handle mouse wheel, new QSkipMotion()			*
 * ./grid/gridma1.c:
 * 18-Feb-2014: new routines GfDelRemoveNodeLine(), GfInsertNodeLine()	*
 * ./grid/grid.c:
 * 18-Feb-2014: new menu items for line (del node, remove node, insert) *
 * ./grid/gridlo.c:
 * 05-Mar-2014: new action for drag and mouse wheel			*
 * ./grid/events.h:
 * 05-Mar-2014: handle also mouse wheel					*
c ./femplot/plotsim.f:
c 05.03.2014	ggu	bug fix: isphe was not stored
c
c ./femplot/supout.f:
c 05.03.2014  ggu     new read for ous and nos files (use date)
c
c ./femplot/supano.f:
c 05.03.2014  ggu     in annotation use date information
c
c ./femplot/suplin.f:
c 05.03.2014    ggu     bug fix for reference vector
c
c ./fem3d/subnsh.f:
c 05.03.2014    ggu     code prepared to repeat time step (irepeat) - not ready
c
c ./fem3d/subdts.f:
c 05.03.2014    ggu     new subdts.h and new routine dts_has_date()
c
c ./fem3d/subver.f:
c 07.03.2014	ggu	version 6.1.72
c
c ./fem3d/basbathy.f:
c 13.02.2014	ggu	new data written, can read also bas file
c 05.03.2014	ggu	subroutines copied to other routine
c
c ./fem3d/newconz.f:
c 13.02.2014    ggu     routines for reading initial condition
c
c ./fem3d/subinterpol.f:
c 21.02.2014	ggu	subroutines copied from basbathy
c
c ./fem3d/subinterpol1.f:
c 27.02.2014    ggu     subroutines copied from basbathy
c
c ./fem3d/arc/basbathy_03.f:
c 13.02.2014	ggu	new data written, can read also bas file
c
c ./fem3d/scalintp.f:
c 13.02.2014	ggu	new data written, can read also bas file
c
c ./fem3d/subgeo.f:
c 21.02.2014	ggu	new routine centert and centerpoly

==========================================================

version  6_1_71    28-01-2014    VERS_6_1_71   commit_2014-03-07

version  6_1_71    28-01-2014    VERS_6_1_71   commit_2014-02-18

version  6_1_71    28-01-2014    VERS_6_1_71

========================================================== 28-01-2014 - 6_1_71

c ./femplot/supbas.f:
c 13.12.2013  ggu     new mode=4 for plotting grey grid over scalar variable
c
c ./fem3d/subetsa.f:
c 24.01.2014    ggu     copied from subexta.f
c
c ./fem3d/subnos.f:
c 18.01.2014	ggu	restructured, new date,time,femver (version 4+5)
c
c ./fem3d/subnls.f:
c 20.01.2014	ggu	new routine nrdtable()
c
c ./fem3d/subousa.f:
c 20.01.2014	ggu	new calls for ous writing implemented
c
c ./fem3d/etsinf.f:
c 24.01.2014    ggu     copied from nosinf.f
c
c ./fem3d/subres.f:
c 20.01.2014    ggu     new calls to ous routines
c
c ./fem3d/subets.f:
c 24.01.2014	ggu	copied from subnos.f
c
c ./fem3d/subver.f:
c 28.01.2014	ggu	version 6.1.71
c
c ./fem3d/bdist.f:
c 13.12.2013    ggu     make local distances using boundary parameter nad
c
c ./fem3d/splitets.f:
c 27.01.2014	ggu	copied from splitext
c
c ./fem3d/etsutil.f:
c 24.01.2014    ggu     copied from nosutil.f
c
c ./fem3d/nosutil.f:
c 20.01.2014    ggu     new helper routines
c
c ./fem3d/subous.f:
c 18.01.2014	ggu	restructured, new date,time,femver
c
c ./fem3d/subcon1.f:
c 20.01.2014    ggu	new writing format for nos files in confop, confil
c
c ./fem3d/ousutil.f:
c 20.01.2014    ggu     new helper routines

==========================================================

version  6_1_70    05-12-2013    VERS_6_1_70   commit_2014-01-28

version  6_1_70    05-12-2013    VERS_6_1_70

========================================================== 05-12-2013 - 6_1_70

c ./fem3d/subver.f:
c 05.12.2013	ggu	version 6.1.70
c
c ./fem3d/newcon.f:
c 03.12.2013    ggu&deb bug fix for horizontal diffusion
c
c ./fem3d/subbnd.f:
c 29.11.2013    ggu	allow for non continous boundary numbering
c
c ./fem3d/new3di.f:
c 29.11.2013    ggu	zeta correction
c
c ./fem3d/subele.f:
c 29.11.2013    ggu     new subroutine masscont()
c
c ./fem3d/subn11.f:
c 29.11.2013    ggu     prepared for ibtyp == 0

==========================================================

version  6_1_69a    12-11-2013    VERS_6_1_69a   commit_2013-12-05

version  6_1_69a    12-11-2013    VERS_6_1_69a

========================================================== 12-11-2013 - 6_1_69a

c ./fem3d/subver.f:
c 12.11.2013	ggu	version 6.1.69a

==========================================================

version  6_1_69    12-11-2013    VERS_6_1_69   commit_2013-11-12

version  6_1_69    12-11-2013    VERS_6_1_69

========================================================== 12-11-2013 - 6_1_69

c ./femplot/supiso.f:
c 29.10.2013    ggu     new routine pldif (plotting isolines between areas)
c
c ./fem3d/subver.f:
c 12.11.2013	ggu	version 6.1.69	San Martino's release
c
c ./fem3d/new3di.f:
c 29.10.2013    ggu	nudging implemented
c
c ./fem3d/ht.f:
c 29.10.2013    ggu	nudging implemented

==========================================================

version  6_1_68    25-10-2013    VERS_6_1_68   commit_2013-11-12

version  6_1_68    25-10-2013    VERS_6_1_68

========================================================== 25-10-2013 - 6_1_68

c ./femplot/col.f:
c 01.10.2013    ggu     bug fix for valmin/valmax too close
c
c ./fem3d/tmp/new/newexpl_ggu5.f:
c 13.09.2013	dbf&ggu	new sigma layer adjustment integrated
c
c ./fem3d/tmp/new/newexpl.f:
c 13.09.2013	dbf&ggu	new sigma layer adjustment integrated
c
c ./fem3d/tmp/netcdf/ts2nc.f:
c 25.09.2013    ggu     restructured
c
c ./fem3d/vp.f:
c 04.10.2013    ggu     in optest better error handling
c
c ./fem3d/subver.f:
c 25.10.2013	ggu	version 6.1.68
c
c ./fem3d/subnev.f:
c 30.09.2013	ggu	new routines gradient_normal/tangent
c
c ./fem3d/netcdf.f:
c 25.09.2013    ggu	new routines for writing time series
c
c ./fem3d/ts2nc.f:
c 25.09.2013    ggu     restructured

==========================================================

version  6_1_67    12-09-2013    VERS_6_1_67   commit_2013-10-25

version  6_1_67    12-09-2013    VERS_6_1_67

========================================================== 12-09-2013 - 6_1_67

c ./femplot/plotsim.f:
c 05.09.2013	ggu	better handling of variable
c
c ./femplot/supsim.f:
c 05.09.2013    ggu	endtime() and nplot introduced
c
c ./femplot/suptim.f:
c 05.09.2013  ggu     new routine endtime()
c
c ./femplot/supout.f:
c 03.09.2013  ggu     level_k2e -> level_k2e_sh, level_e2k -> level_e2k_sh
c
c ./femplot/supdep.f:
c 05.09.2013    ggu     adapt to new get_layer_thickness()
c
c ./femplot/supano.f:
c 05.09.2013  ggu     adjust for scale distortion in ref and wind arrows
c
c ./femplot/supint.f:
c 05.09.2013  ggu     handle variable choice better
c
c ./fem3d/subver.f:
c 12.09.2013	ggu	version 6.1.67
c
c ./fem3d/sigmautil.f:
c 05.09.2013	ggu	new call interface to get_layer_thickness()
c
c ./fem3d/ousextr_nodes.f:
c 05.09.2013    ggu     new call to get_layer_thickness()
c
c ./fem3d/newbcl.f:
c 05.09.2013    ggu     limit salinity to [0,...]
c
c ./fem3d/newsig.f:
c 05.09.2013    ggu	no set_sigma_hkv_and_hev()
c
c ./fem3d/nosextr_nodes.f:
c 05.09.2013    ggu     new call to get_layer_thickness()
c
c ./fem3d/subnsa.f:
c 22.08.2013	ggu     new string2ivar() and similar changes
c 05.09.2013	ggu     nlsa now wants integer, better handling of what to read
c
c ./fem3d/ht.f:
c 05.09.2013    ggu	changed order of adjust depth and barene structures
c
c ./fem3d/genutil.f:
c 05.09.2013	ggu	new routine compute_levels_on_element()
c
c ./fem3d/nosutil.f:
c 05.09.2013    ggu     new call to get_layer_thickness()
c
c ./fem3d/subdep.f:
c 05.09.2013	ggu	new routine set_sigma_hkv_and_hev() from newsig.f
c
c ./fem3d/newini.f:
c 23.08.2013    ggu	renamed adjust_k_depth() to make_hkv() -> to subdep
c 23.08.2013    ggu	depth routines to subdep.f
c 05.09.2013    ggu	in adjust_levels() allow for nlv==1
c
c ./fem3d/ousutil.f:
c 05.09.2013    ggu     new call to get_layer_thickness()
c
c ./fem3d/subapn.f:
c 05.09.2013	ggu	read_apn_file() needs integer now

==========================================================

version  6_1_66    19-06-2013    VERS_6_1_66   commit_2013-09-12

version  6_1_66    19-06-2013    VERS_6_1_66   commit_2013-08-23

version  6_1_66    19-06-2013    VERS_6_1_66

========================================================== 19-06-2013 - 6_1_66

c ./femplot/supbas.f:
c 14.06.2013  ggu     bug fix in calling scale_legend -> get dims
c
c ./fem3d/subtsuvfile.f:
c 17.06.2013    ggu     do not pass finction into subroutine
c
c ./fem3d/subver.f:
c 19.06.2013	ggu	version 6.1.66
c
c ./fem3d/subbfm.f:
c 17.06.2013    ggu	bug fix: wsinkv was not present in call
c
c ./fem3d/suboff.f:
c 17.06.2013    ggu     eliminated compiler warnings

==========================================================

version  6_1_65    13-06-2013    VERS_6_1_65   commit_2013-06-19

version  6_1_65    13-06-2013    VERS_6_1_65

========================================================== 13-06-2013 - 6_1_65

c ./femplot/plotsim.f:
c 13.06.2013	ggu	new plotting for fem files
c
c ./femplot/supsim.f:
c 13.06.2013    ggu	new routine plofem()
c
c ./femplot/supbas.f:
c 13.06.2013  ggu     bug fix in spherical_fact() -> set fact to 1
c
c ./femplot/supout.f:
c 13.06.2013  ggu     new routines for handling FEM files
c
c ./femplot/supdep.f:
c 10.06.2013    ggu     bug fix in mkht,mkht3 (get_layer_thicknes_e)
c
c ./femplot/col.f:
c 13.06.2013    ggu     small bug fix for computation of dval with rnext
c
c ./femplot/supint.f:
c 13.06.2013  ggu     scans varnam to decide what to plot
c
c ./fem3d/subver.f:
c 13.06.2013	ggu	version 6.1.65
c
c ./fem3d/sigmautil.f:
c 17.05.2013	ggu	layer_thickness for elem and node, general routine
c 17.05.2013	ggu	new routine get_bottom_of_layer()
c
c ./fem3d/basbathy.f:
c 13.06.2013	ggu	copy_depth() renamed to transfer_depth()
c
c ./fem3d/ousextr_nodes.f:
c 17.05.2013    ggu     prepared for write_profile
c
c ./fem3d/subvintp.f:
c 04.06.2013    ggu     bug fix: restore altered values zb1_save,var1_save
c
c ./fem3d/nosextr_nodes.f:
c 17.05.2013    ggu     prepared for write_profile
c
c ./fem3d/subnsa.f:
c 13.06.2013	ggu     read also varnam to decide what to plot and read
c
c ./fem3d/subsys.f:
c 16.05.2013	ggu	file name bound renamed to zinit
c
c ./fem3d/subflxu.f:
c 14.05.2013    ggu     deleted error check between 2d and 3d computation
c
c ./fem3d/ht.f:
c 13.06.2013    ggu	set/copydepth simplified, offline version
c
c ./fem3d/basbox.f:
c 14.05.2013    ggu     subroutines cleaned
c
c ./fem3d/subele.f:
c 13.06.2013    ggu     new helper functions make_old_depth and copy_depth
c
c ./fem3d/newexpl.f:
c 10.05.2013	dbf&ggu	new routines for vertical advection (bvertadv)
c 10.05.2013	dbf&ggu	new routines for non-hydro
c 25.05.2013	ggu	new version for vertical advection (bvertadv)
c
c ./fem3d/subboxa.f:
c 14.05.2013    ggu     write also OBC sections and contributions
c
c ./fem3d/bastreat.f:
c 13.06.2013    ggu     copy_depth() renamed to transfer_depth()
c
c ./fem3d/subfemfile.f:
c 16.05.2013	ggu	better documentation
c
c ./fem3d/suboff.f:
c 13.06.2013    ggu     new routines written from scratch

==========================================================

version  6_1_64    10-05-2013    VERS_6_1_64   commit_2013-06-13

version  6_1_64    10-05-2013    VERS_6_1_64   commit_2013-05-17

version  6_1_64    10-05-2013    VERS_6_1_64   commit_2013-05-14

version  6_1_64    10-05-2013    VERS_6_1_64

========================================================== 10-05-2013 - 6_1_64

c ./fem3d/subver.f:
c 10.05.2013	ggu	version 6.1.64
c
c ./fem3d/newnohydro.f:
c 10.05.2013    dbf     written from scratch
c
c ./fem3d/subflxa.f:
c 10.05.2013    ggu     introduced subflxa.h, common routines to subflxu.f
c
c ./fem3d/subsys.f:
c 10.05.2013	ggu	new parameters idtbox,itmbox, more comments
c 10.05.2013	ggu	new parameter inohyd
c
c ./fem3d/subflxu.f:
c 09.05.2013    ggu     separated from subflxa.f
c
c ./fem3d/new3di.f:
c 10.05.2013    dbf&ggu new routines for non-hydro
c
c ./fem3d/ht.f:
c 10.05.2013    dbf	initialization for non hydrostatic routines
c
c ./fem3d/basbox.f:
c 07.05.2013    ggu     copied from bastreat
c
c ./fem3d/newexpl.f:
c 10.05.2013	dbf&ggu	new routines for non-hydro and vertical advection
c
c ./fem3d/subboxa.f:
c 10.05.2013    ggu     adapted to boxes computations

==========================================================

version  6_1_63    03-05-2013    VERS_6_1_63   commit_2013-05-10

version  6_1_63    03-05-2013    VERS_6_1_63

========================================================== 03-05-2013 - 6_1_63

c ./femplot/plotsim.f:
c 27.02.2013	ggu	deleted amat, better color handling
c
c ./femplot/supbas.f:
c 02.05.2013  ggu     handle fact in spherical coords, meteo point plotting
c
c ./fem3d/subnls.f:
c 27.02.2013	ggu	handle extra information on section line
c
c ./fem3d/subver.f:
c 03.05.2013	ggu	version 6.1.63
c
c ./fem3d/subnsa.f:
c 27.02.2013	ggu     pass what parameter into nlsa, handle extra info
c
c ./fem3d/netcdf.f:
c 28.01.2013    dbf	different types of vertical coordinates
c
c ./fem3d/netcdf_util.f:
c 20.02.2013    ggu     new routines get_period() and check_period()
c
c ./fem3d/ous2nc.f:
c 20.02.2013    ggu     choose period implemented
c
c ./fem3d/subscn.f:
c 20.02.2013	ggu	new routine iscand, istof changed to istod
c
c ./fem3d/nos2nc.f:
c 20.02.2013    ggu     choose period implemented
c
c ./fem3d/subrgf.f:
c 02.05.2013    ggu     bug fix: call to rgf_intp() was wrong
c
c ./fem3d/subapn.f:
c 27.02.2013	ggu	pass what parameter into nlsa

==========================================================

version  6_1_62    25-01-2013    VERS_6_1_62   commit_2013-05-03

version  6_1_62    25-01-2013    VERS_6_1_62

========================================================== 25-01-2013 - 6_1_62

c ./fem3d/subnos.f:
c 21.01.2013	ggu	code for next and back record
c
c ./fem3d/tmp/ous2nc_fem.f:
c 21.01.2013    ggu     restructured
c
c ./fem3d/tmp/ous2nc_reg.f:
c 21.01.2013    ggu     restructured
c
c ./fem3d/tmp/nos2nc_fem.f:
c 21.01.2013    ggu     restructured
c
c ./fem3d/tmp/ous2nc.f:
c 21.01.2013    ggu     restructured
c
c ./fem3d/tmp/nos2nc.f:
c 21.01.2013    ggu     restructured
c
c ./fem3d/tmp/nos2nc_reg.f:
c 21.01.2013    ggu     restructured
c
c ./fem3d/subver.f:
c 25.01.2013	ggu	version 6.1.62
c
c ./fem3d/ousextr_nodes.f:
c 25.01.2013    ggu     code cleaned
c
c ./fem3d/lagrange_track.f:
c 25.01.2013    ggu     error check to avoid segfault (INTERNAL ERROR)
c
c ./fem3d/sedi3d.f:
c 25.01.2013    ggu     mixed real/double common blocks spearated
c
c ./fem3d/nosextr_nodes.f:
c 25.01.2013    ggu     routines cleaned
c
c ./fem3d/netcdf.f:
c 25.01.2013    ggu	new part for nos variable initialization
c
c ./fem3d/ousinf.f:
c 25.01.2013    ggu     utility routines to ousutil.f
c
c ./fem3d/netcdf_util.f:
c 21.01.2013    ggu     routines transfered from ous2nc.f
c
c ./fem3d/genutil.f:
c 25.01.2013	ggu	new routine level_k2e()
c
c ./fem3d/ous2nc.f:
c 21.01.2013    ggu     restructured
c 25.01.2013    ggu     regular and fem outout in one routine
c
c ./fem3d/nosutil.f:
c 25.01.2013    ggu     new routines nos_get_vars()
c
c ./fem3d/ousutil.f:
c 21.01.2013    ggu     added two new routines comp_vel2d, comp_barotropic
c
c ./fem3d/nos2nc.f:
c 21.01.2013    ggu     restructured

==========================================================

version  6_1_61a    17-12-2012    VERS_6_1_61a   commit_2013-01-25

version  6_1_61a    17-12-2012    VERS_6_1_61a

========================================================== 17-12-2012 - 6_1_61a

c ./fem3d/subnos.f:
c 02.12.2012	ggu	restructured
c
c ./fem3d/subver.f:
c 17.12.2012	ggu	version 6.1.61a
c
c ./fem3d/ousextr_records.f:
c 17.12.2012    ggu     bug: opened nos file instead of ous file

==========================================================

version  6_1_61    19-11-2012    VERS_6_1_61   commit_2012-12-17

version  6_1_61    19-11-2012    VERS_6_1_61

========================================================== 19-11-2012 - 6_1_61

c ./fem3d/subnos.f:
c 16.11.2012	ggu	in wrnos bugfix - call setnos first
c
c ./fem3d/intp.f:
c 16.11.2012	ggu	if franco == 99 -> use PS as forecast (init_ps)
c
c ./fem3d/subver.f:
c 19.11.2012	ggu	version 6.1.61
c
c ./fem3d/splitext.f:
c 16.11.2012	ggu	allow for direct writing values to files (bdirect)

==========================================================

version  6_1_60    05-11-2012    VERS_6_1_60

========================================================== 05-11-2012 - 6_1_60

c ./fem3d/subtsuvfile.f:
c 29.10.2012    ggu     created from scratch
c
c ./fem3d/subnos.f:
c 30.10.2012	ggu	new format for date and time (new accessor routines)
c
c ./fem3d/subver.f:
c 05.11.2012	ggu	version 6.1.60
c
c ./fem3d/newbcl.f:
c 31.10.2012    ggu     open and next_record transfered to subtsuvfile.f
c
c ./fem3d/subreg.f:
c 26.10.2012	ggu	bug fix: do not access not existing storage

==========================================================

version  6_1_59    25-10-2012    VERS_6_1_59   commit_2012-11-05

version  6_1_59    25-10-2012    VERS_6_1_59

========================================================== 25-10-2012 - 6_1_59

c ./femplot/supbas.f:
c 24.10.2012  ggu     bug in labelling non spherical grid (returned -1)
c
c ./femplot/suplin.f:
c 22.10.2012    ggu     dxmin introduced to plot arrow every dxmin distance
c 24.10.2012    ggu     bsmooth introduced for smooth bottom plotting
c
c ./fem3d/subdts.f:
c 23.10.2012    ggu     unpackdate() and dtsini() accepts also only year
c
c ./fem3d/lagrange_main.f:
c 22.10.2012    ggu     call connectivity also after diffusion
c 22.10.2012    ggu     limit release to itranf/end
c
c ./fem3d/lagrange_cont.f:
c 23.10.2012    ggu	do not call connectivity here anymore
c
c ./fem3d/subver.f:
c 25.10.2012	ggu	version 6.1.59
c
c ./fem3d/subbfm.f:
c 22.10.2012    ggu	saved some variables
c
c ./fem3d/lagrange_connect.f:
c 22.10.2012    ggu	prepared for circular area to receive particles
c
c ./fem3d/subreg.f:
c 10.10.2012	ggu	new routine fm2am2d() and fm2am3d()
c
c ./fem3d/subsys.f:
c 24.10.2012	ggu	new parameter dxmin

==========================================================

version  6_1_58    08-10-2012    VERS_6_1_58   commit_2012-10-25

version  6_1_58    08-10-2012    VERS_6_1_58

========================================================== 08-10-2012 - 6_1_58

c ./femplot/suplag.f:
c 01.10.2012    ggu     use station to get color in plot (ip_station)
c
c ./fem3d/prep_input.f:
c 03.10.2012    ggu     written from basinf
c
c ./fem3d/subver.f:
c 08.10.2012	ggu	version 6.1.58
c
c ./fem3d/newbsig.f:
c 05.10.2012    ggu     intp_vert() and intp_aver() transfered to subvintp.f
c
c ./fem3d/subvintp.f:
c 04.10.2012    ggu     copied from newbsig.f
c
c ./fem3d/lagrange_inout.f:
c 01.10.2012    ggu	output concentrations only for one station
c
c ./fem3d/subfile.f:
c 02.10.2012	ggu	created from scratch

==========================================================

version  6_1_57    12-09-2012    VERS_6_1_57   commit_2012-10-08

version  6_1_57    12-09-2012    VERS_6_1_57

========================================================== 12-09-2012 - 6_1_57

c ./femplot/supbas.f:
c 30.08.2012  ggu     new routines to automaticallylabel spehrical grid
c
c ./fem3d/subver.f:
c 12.09.2012	ggu	version 6.1.57
c
c ./fem3d/subnev.f:
c 30.08.2012	ggu	new routine is_spherical()

